url,url_mobile,title,seendate,socialimage,domain,language,sourcecountry,ticker,industry,search_keyword,article_text
https://www.yahoo.com/news/poised-growth-turkish-defense-firms-214401171.html,,"Poised for growth , Turkish defense firms scramble for new exports",20240806T221500Z,https://s.yimg.com/ny/api/res/1.2/pq6IaSkfD088Y29rO9C8vA--/YXBwaWQ9aGlnaGxhbmRlcjt3PTEyMDA7aD02NzU-/https://media.zenfs.com/en/defense_news_499/1ffa4dac8033e99fe202d18c4b9a493c,yahoo.com,English,United States,ITA,Aerospace & Defense,defense,"Yahoo is using AI to generate takeaways from this article. This means the info may not always match what's in the article. Reporting mistakes helps us improve the experience. Generate Key Takeaways The Defense News Top 100 list of defense companies for 2024 includes five Turkish firms, up from four in 2023, amid rising global demand for Turkish defense products and increasing maturation of the Turkish defense industrial sector in terms of breadth and sophistication. Ranked Turkish companies include: ASELSAN (42, up from 47 last year): producer of defense electronics, especially communications and sensors. ASELSAN was the first Turkish company to crack the Top 100 in 2008 and has consistently been the leading Turkish defense revenue generator. Turkish Aerospace Industries (TAI or TUSAS ) (50, up from 58): leader in Turkish defense aerospace joined the Top 100 in 2012 and has been the second-ranked Turkish firm since. ROKETSAN (71, up from 80): producer of unguided rockets and guided missiles has seen revenues grow in large part due to integration of its products on Turkish unmanned systems Machine and Chemical Industry ( MKE ) (84, new): producer of small arms, artillery and ammunition; shifted from a state-owned enterprise to a joint stock company in 2022. Has helped meet booming demand for artillery and related munitions. Military Factory and Shipyard Enterprise ( AFSAT ) (94, new): aircraft, naval and land systems production and overhaul. Major deals with Pakistan (MILGEM) Burkina Faso/Togo (minesweepers). Several intriguing aspects of this grouping stand out. First, Turkey occupies an elite tier among international arms producers. Only eight countries have more than two companies in the Top 100, and only three — the U.S., U.K. and China — have more Top 100 firms than Turkey. Advertisement Advertisement Advertisement Advertisement The Top 100 is here: Find out how defense companies performed in FY23 The U.S. is in a class of its own, but with 25% defense export growth and $5.5 billion revenue in 2023 , the Turks have risen to near the top of the second tier. Second, arguably the most dynamic sector in the Turkish defense industry — unmanned systems — has yet to produce a Top 100 firm, but seems poised to do so moving forward. BAYKAR , makers of the TB2 Bayraktar and Akinci Unmanned Combat Aerial Vehicles, has become the standard bearer for Turkish defense innovation and operational impact across various global hotspots. TAI produces high-quality drones as well, and a half-dozen other companies have established Turkey as an innovation and price-performance leader in the field. That five Turkish companies not centered on unmanned systems made the Top 100 makes clear that an understanding of Turkish defense needs to look beyond the headline-generating drones. Advertisement Advertisement Advertisement Advertisement Third, such growth could not have happened without an expanding network of clients and partners for the Turkish defense industry; while indigenization has increased the milli ve yerli (locally/nationally produced) portion of domestic defense needs, globally significant firms require foreign markets and partnerships. Turkish defense sector firms — there are over 3,500 total — have built partnerships with Ukraine , the U.K. , Pakistan , Gulf countries and many others . The Turkish Ministers of Defense (Yasar Guler) and Defense Industry (Haluk Gorgun) addressed a bilateral Defense Industrial Base conference in Washington on the sidelines of the recent NATO summit, and touted the Turkish defense sector as young, dynamic, enjoying unique access in the Mideast, Africa, Balkans, Central and South Asia — and uniquely positioned to partner with U.S. firms. Guler assessed during the conference that Turkish exports in the first half of 2024 showed continued growth, up 20% year on year. An interesting bit of context for this year’s Top 100 is the directed efforts in Washington and Ankara to deepen and broaden defense cooperation between the two NATO allies. The Turkish American Business Council (TAIK, headed by Murat Ozyegin) and the American Turkish Business Roundtable (ATBR, led by retired Gen. James Jones) have convened two conferences in 2024 to bring U.S. and Turkish firms together to explore areas for collaboration and cooperation in the defense sector. Advertisement Advertisement Advertisement Advertisement With the example of the recently approved F-16 deal and joint venture for 155mm artillery ammunition between Turkish and American firms , we might expect to see many more such joint ventures emerge. The Turkish defense industry still faces growing pains and dilemmas, though. The International Institute for Strategic Studies noted in a recent study that the Turkish defense industry is at a crossroads: Having increased self-sufficiency and developed significant export capabilities through defense sector indigenization, it has developed a new dependence on sustained exports and defense industrial cooperation for advanced subsystems. Substantial autonomy does not mean full independence in the defense sector but rather continued complex interdependence. This implies that continued growth will require proactive consultation and mutual compromise between Ankara, Washington and NATO allies in Europe. Another check on growth has been the Turkish government’s struggles with inflation, which is currently subject to a significant campaign of monetary tightening. Upward pressure on interest rates from the battle against hyperinflation has made domestic bank loans less attractive for developing small firms into major defense industrial players. Advertisement Advertisement Advertisement Advertisement One solution has been for such firms to pursue public listing rather than domestic bank or government financing. Demand remains high in the global market for the solid price-performance balance that has typified Turkish defense products. That augurs well for the continued growth of the five current Top 100-member Turkish firms and those aspiring to join the club. If 2024 sees progress in Ankara’s efforts to bring down inflation, continued macroeconomic stability and sustained Great Power Competition, this year’s strong performance from the Turkish national defense sector should be reprised or accelerated over the next twelve months. Richard Outzen is a nonresident senior fellow at the Atlantic Council’s Turkey Program. About Our Ads"
https://www.fool.com/investing/2024/08/05/ge-aerospace-had-a-solid-quarter-heres-why-i-would/?source=iedfolrf0000001,,GE Aerospace Had a Solid Quarter . Here Why I Wouldnt Buy the Stock . ,20240806T024500Z,https://g.foolcdn.com/editorial/images/785559/partially-disassembled-turbine-engine-of-a-passenger-jet-aircraft.jpg,fool.com,English,United States,ITA,Aerospace & Defense,aerospace,"It's a brave new world for aerospace propulsion company GE Aerospace ( GE 0.39% ) . After operating as an industrial conglomerate for more than 130 years, growing to become a bellwether, blue chip industrial firm, GE spun off its various core businesses. Since April 2, 2024, the history-steeped GE stock ticker symbol has represented GE Aerospace, a leaner company exclusively focused on civilian and military propulsion systems. Though it has only been a stand-alone company for two quarters now, GE Aerospace is off to a profitable start. Expand NYSE : GE GE Aerospace Today's Change ( -0.39 %) $ -1.22 Current Price $ 310.72 Key Data Points Market Cap $329B Day's Range $ 307.05 - $ 312.72 52wk Range $ 159.36 - $ 316.67 Volume 2.7M Avg Vol 4M Gross Margin 37.67 % Dividend Yield 0.00 % GE Aerospace's fantastic second quarter of 2024 The company reported strong earnings that included across-the-board growth in orders, operating margin and profit, and free cash flow. Orders up 18%, to $11.2 billion Adjusted revenue up 4%, to $8.2 billion Operating profit up 37%, to $1.9 billion Adjusted earnings per share up $0.46, to $1.20 per share Free cash flow up $200 million, to $1.1 billion These second-quarter results come on the heels of a similarly strong first quarter. Clearly, GE Aerospace is building momentum as a stand-alone entity. Besides the profitable results, the company also issued upward revised guidance for full-year 2024, forecasting free cash flow of $5.3 billion to $5.6 billion, operating profits of $6.5 billion to $6.8 billion, and adjusted earnings per share of $3.95 to $4.20. The bullish revision to its guidance makes sense, since the company also reported new agreements to supply engines for 34 aircraft for four different airlines. As part of GE Aerospace's focus on operational results, the company reported progress on its Flight Deck strategic plan. By the close of the second quarter, it had made progress growing efficiencies at the majority of its 15 largest suppliers. In total, GE Aerospace's second quarter was chock-full of encouraging news. GE Aerospace is executing an investor-friendly capital allocation plan The profitable operating results from the first two quarters of the year aren't the only encouraging signs for investors in GE Aerospace. Since operating as a stand-alone company, GE Aerospace has been implementing a capital allocation plan that favors investors. The plan involves the regular payment of dividends as well as share repurchases. During the second quarter of 2024, the company repurchased 11.7 million shares and paid a dividend of $0.28 per share; the dividend is currently yielding 0.66% on a forward basis. As part of the company's overall strategic plan that is focused on operational leanness, GE Aerospace either completed or reached agreements to sell several legacy insurance and licensing businesses. The focus for the future is very much on the core propulsion business, and management seems determined to help shareholders reap the rewards of its pinpoint focus. GE Aerospace stock is fully valued and not a buy at current levels Things are going well for GE Aerospace, and with the more concentrated focus on propulsion, growing sales and earnings, and an emphasis on rewarding shareholders, there is little for investors to quibble with -- except for the share price. Up over 80% in the last year, shares have come a long way very quickly. Analyzing GE Aerospace on traditional valuation metrics, especially in comparison to competitor RTX Corporation ( RTX +0.11% ) , reveals that shares are currently not attractive on a valuation basis. Ticker Price-to-free cash flow per share Price-to-earnings ratio Price-to-sales ratio Price-to-book value ratio Dividend coverage ratio GE 52.0 40.3 2.7 9.9 8.1 RTX 35.4 21.4 2.4 2.6 0.7 On every one of the traditional valuation metrics shown in the table, GE Aerospace is more expensive than RTX; in several cases, substantially so. One area where GE Aerospace shows more potential than RTX is in its dividend coverage; its coverage ratio is substantially higher than RTX's. This higher ratio not only means that GE Aerospace can easily afford its dividend, it also shows there is substantial room to increase its dividend, which could be attractive to income investors. The bottom line is that GE Aerospace is off to a strong start as a stand-alone company, but its shares are too expensive right now. Value-oriented investors should watch for a drop in share price, looking for an opportunity to buy this quality company ""on sale."""
https://www.fool.com/investing/2024/08/02/heres-why-this-hot-aerospace-stock-surged-this-wee/?source=iedfolrf0000001,,Here Why This Hot Aerospace Stock Surged This Week,20240802T134500Z,https://g.foolcdn.com/editorial/images/785686/boeing_737_max_7_plane_airplane_aviation_source_boeing.jpg,fool.com,English,United States,ITA,Aerospace & Defense,aerospace,"Howmet Aerospace ( HWM 0.40% ) stock is up a whopping 75% in 2024 and rose 14.7% in the last week to Friday morning trading. The latest leg up is due to its impressive second-quarter earnings release earlier this week. Howmet's end markets The company generates around 52% of its sales from commercial aerospace and 16% from defense aerospace, with commercial transportation at about 18%. The remaining 14% is under the ""industrial and other"" heading. Its crucial end markets are jet engine components, aerospace fastening systems, and airframe structural components. Expand NYSE : HWM Howmet Aerospace Today's Change ( -0.40 %) $ -0.84 Current Price $ 208.90 Key Data Points Market Cap $84B Day's Range $ 204.80 - $ 209.96 52wk Range $ 105.04 - $ 211.95 Volume 1.4M Avg Vol 2.1M Gross Margin 30.03 % Dividend Yield 0.00 % Key customers include aerospace and defense giants GE Aerospace (12% of 2023 revenue) and RTX (9%). While it's no secret that end market demand for airplanes (commercial or defense) remains robust, and manufacturers like Boeing and Airbus have multiyear backlogs, there are questions about delivery rates. Boeing's delivery issues are well documented , and Airbus recently lowered its guidance for airplane deliveries. Moreover, this year, GE Aerospace has significantly reduced its 2024 guidance for production of the LEAP engine, which powers the Airbus A320 neo and the Boeing 737 MAX. Howmet's earnings dispel fears That said, Howmet beat expectations for the second quarter, and management raised its full-year revenue, earnings, and cash-flow guidance. Instead of a baseline case of $2.35 in earnings per share (EPS), management now expects $2.55. Image source: Boeing. Discussing the airplane volume issue on the earnings call, CEO John Plant said that, despite slowing its production, Airbus was still increasing its requirements. Meanwhile, parts orders at Boeing ""continue to be at levels above the actual 737 and 787 build rates."" Indeed, Boeing expects a recovery in build rates on the 737 MAX to hit 38 a month by year-end. That would be good news for Howmet, and it can continue its strong operational performance."
https://www.investors.com/research/ibd-stock-analysis/ge-aerospace-ge-stock-ready-for-takeoff/,,GE Aerospace Soared 358 % In Two Years . Now It Takes Off Again . ,20240801T160000Z,https://www.investors.com/wp-content/uploads/2024/07/Stock-airplaneclouds-generatedwithai-03-adobe.jpg,investors.com,English,United States,ITA,Aerospace & Defense,aerospace,"In a reorganization of historic proportions, General Electric has completed its spinoffs of GE Aerospace, GE HealthCare and sustainable-energy-focused GE Vernova. Sometimes called the ""crown jewel,"" GE Aerospace (GE) has earned that moniker, with shares soaring 358% in two years, from a low in July 2022 until clearing a 170.80 buy point last week. But after testing a new buy…"
https://www.marketscreener.com/quote/stock/GE-AEROSPACE-4823/news/GE-Aerospace-Turkish-I-Class-MILGEM-Project-Gets-a-Power-Boost-with-Additional-LM2500-Engines-47516041/,,GE Aerospace : Turkish I - Class MILGEM Project Gets a Power Boost with Additional LM2500 Engines,20240731T120000Z,https://www.marketscreener.com/images/twitter_MS_fdnoir.png,marketscreener.com,English,,ITA,Aerospace & Defense,aerospace,"GE Aerospace : Turkish I-Class MILGEM Project Gets a Power Boost with Additional LM2500 Engines Published on 07/31/2024 at 07:44 am EDT - Modified on 07/31/2024 at 07:45 am EDT Publicnow Share GE Aerospace -0.39% Evendale, Ohio; July 31, 2024: One year after GE Aerospace signed an agreement with TAIS OG-STM İş Ortaklığı in Istanbul, Türkiye, to provide LM2500 marine gas turbines for the İstif-Class frigates number 6 - 8 in the MILGEM project, an order for frigates number 9 - 12 has been initiated. GE Aerospace's LM2500, an engine powered by decades of innovation, will supply 23 MW of power to each frigate. İstif-Class Frigate Project, Photo courtesy of STM The İstif -class (or I-class) frigates are an enlarged version of the Ada-class corvettes, which are also powered by LM2500 gas turbines, that feature a slightly larger hull for improved endurance, increased range capability, and longer-range weapons. The MILGEM project is a highly successful program for the Turkish Navy based on regional and global cooperation and has been exported to other countries. GE Aerospace has provided reliable propulsion solutions to the Turkish Naval Forces since 1997. Currently, a total of 31 LM2500 gas turbines are onboard 18 ships for Türkiye. In addition to the Ada class corvettes and frigates of the MILGEM project, programs include the Barbaros and Gabya class frigates and DIMDEG fleet oil replenishment vessel. With extensive fleet experience and a proven reliability for the Turkish Navy, the LM2500 family of engines is ideal for the Navy's future TF-2000 air defense destroyer. Worldwide, there are 1,140 GE Aerospace marine gas turbines aboard 513 naval vessels, providing reliable power for 39 international navies. Navies also have support around the globe at GE Aerospace's 8 service depots, and interoperability benefits with other allied ships. GE Aerospace has been a committed partner to Türkiye for nearly 60 years. With offices and facilities located in Istanbul, Ankara, and Gebze, our 440+ employees support an installed base of more than 2300 commercial and defense sector engines across the country. Our highly-skilled engineers at the Türkiye Technology Center also contribute to GE Aerospace's global engineering work on new engine programs, software development, and additive manufacturing, supporting the country's position as an advanced aerospace hub. About GE Aerospace Marine Engines & Systems The Marine Engines & Systems business is part of GE Aerospace and offers marine propulsion systems for navies that need battle-ready, power-dense solutions. We are advancing capabilities for warships around the globe through the reliable, expert design of the LM2500 family of marine gas turbines, coupled with GE's ethos of delivering what is essential and surpassing what is expected. GE Aerospace is a world-leading provider of jet engines, components and systems for commercial and military aircraft, and aeroderivative marine propulsion systems, headquartered in Cincinnati, Ohio. For more information, visit geaerospace.com/marine . Attachments Original Link Permalink Disclaimer GE Aerospace - General Electric Company published this content on 31 July 2024 and is solely responsible for the information contained therein. Distributed by Public , unedited and unaltered, on 31 July 2024 11:44:01 UTC . © Publicnow - 2024 Share"
https://www.investors.com:443/news/boeing-supplier-howmet-aerospace-stock-q2-earnings-guidance/,,"Boeing Supplier Howmet Aerospace Breaks Out On Strong Earnings , Guidance , Dividend Hike",20240730T210000Z,https://www.investors.com/wp-content/uploads/2024/07/Stock-HowmetAero-phone-shutt.jpg,investors.com,English,United States,ITA,Aerospace & Defense,aerospace,"Howmet Aerospace stock spiked Tuesday, to break out as the Boeing (BA) supplier reported strong earnings and guidance, as well a big hikes to its dividend and buyback program. Howmet Aerospace (HWM) reported a 52% increase in earnings to 67 cents per share adjusted, clearing FactSet views of 60 cents. Revenue rose 14% to $1.88 billion, which topped analyst estimates…"
https://www.livemint.com/companies/garuda-aerospace-signs-pact-with-french-thales-to-promote-drone-ecosystem-11722353321575.html,https://www.livemint.com/companies/garuda-aerospace-signs-pact-with-french-thales-to-promote-drone-ecosystem/amp-11722353321575.html,Garuda Aerospace signs pact with French Thales to promote drone ecosystem,20240730T171500Z,https://images.livemint.com/img/2024/07/30/600x338/Garuda_Aerospace_1722353489590_1722353489805.jpg,livemint.com,English,India,ITA,Aerospace & Defense,aerospace,"View Market Dashboard Garuda Aerospace signs pact with French Thales to promote drone ecosystem Garuda Aerospace signs pact with French Thales to promote drone ecosystem PTI Published 30 Jul 2024, 09:03 PM IST French aerospace major Thales has inked an initial pact with UAV maker Garuda Aerospace to promote the development of the drone ecosystem in the domestic market. French aerospace major Thales has inked an initial pact with UAV maker Garuda Aerospace to promote the development of the drone ecosystem in the domestic market, the company said on Tuesday. Under the agreement, Thales will provide expertise in unmanned traffic management (UTM) solutions, UAV detection, and system integration, whilst Garuda will bring its skills in manufacturing, Thales said. This collaboration aims to foster innovation and to advance the development of technological solutions that can enable safe and secure drone operations and help the growth of drone-based applications in India, Thales said. ""The government is providing a robust foundation for the drone ecosystem, fostering opportunities for collaboration, innovation, and growth. We are partnering with Garuda Aerospace in paving the way for the development of advanced UTM systems in India by leveraging our extensive global experience and expertise in aeronautical solutions,"" said Ashish Saraf, VP and Country Director, Thales in India. Catch all the Business News , Corporate news , Breaking News Events and Latest News Updates on Live Mint. Download The Mint News App to get Daily Market Updates. Business News Companies Garuda Aerospace signs pact with French Thales to promote drone ecosystem More Story Url has been added to your clipboard Wait for it… Log in to our website to save your bookmarks. It'll just take a moment. Yes, Continue"
https://www.marketscreener.com/quote/stock/HOWMET-AEROSPACE-INC-104922916/news/Howmet-Aerospace-Board-Approves-Common-and-Preferred-Stock-Dividends-47502174/,,Howmet Aerospace Board Approves Common and Preferred Stock Dividends,20240730T111500Z,https://www.marketscreener.com/images/twitter_MS_fdnoir.png,marketscreener.com,English,,ITA,Aerospace & Defense,aerospace,"Howmet Aerospace Board Approves Common and Preferred Stock Dividends Published on 07/30/2024 at 06:59 am EDT - Modified on 07/30/2024 at 07:00 am EDT Business Wire Share Howmet Aerospace Inc. -0.40% The Board of Directors of Howmet Aerospace Inc. (NYSE:HWM) declared (a) a dividend of 8 cents per share on the outstanding Common Stock of the Company, to be paid on August 26, 2024 to the holders of record of the Common Stock at the close of business on August 9, 2024; and (b) a dividend of 93.75 cents per share on the outstanding $3.75 Cumulative Preferred Stock (“Class A Stock”) of the Company, to be paid on October 1, 2024 to the holders of record of the Class A Stock at the close of business on September 13, 2024. About Howmet Aerospace Howmet Aerospace Inc., headquartered in Pittsburgh, Pennsylvania, is a leading global provider of advanced engineered solutions for the aerospace and transportation industries. The Company’s primary businesses focus on jet engine components, aerospace fastening systems, and airframe structural components necessary for mission-critical performance and efficiency in aerospace and defense applications, as well as forged aluminum wheels for commercial transportation. With approximately 1,150 granted and pending patents, the Company’s differentiated technologies enable lighter, more fuel-efficient aircraft and commercial trucks to operate with a lower carbon footprint. For more information, visit www.howmet.com . Dissemination of Company Information Howmet Aerospace intends to make future announcements regarding Company developments and financial performance through its website at www.howmet.com . View source version on businesswire.com: https://www.businesswire.com/news/home/20240730266677/en/ © Business Wire - 2024 Share"
