url,url_mobile,title,seendate,socialimage,domain,language,sourcecountry,ticker,industry,search_keyword,article_text
https://finance.yahoo.com/news/know-ahead-ge-aerospaces-earnings-153024342.html,,What You Need To Know Ahead of GE Aerospace Earnings,20240720T173000Z,https://s.yimg.com/ny/api/res/1.2/uInv07b7aKr.aYLIJrlPUA--/YXBwaWQ9aGlnaGxhbmRlcjt3PTEyMDA7aD04MDA-/https://media.zenfs.com/en/investopedia_245/002e240c589d242d7ee9828c1e0b27ac,finance.yahoo.com,English,United States,ITA,Aerospace & Defense,aerospace,"What You Need To Know Ahead of GE Aerospace's Earnings Aaron McDade July 20, 2024 2 min read GE Getty Images Key Takeaways GE Aerospace reports earnings before markets open Tuesday, in what will be its second report since General Electric completed its split into three separate companies earlier this year. Analysts expect GE Aerospace's revenue to grow year-over-year despite some uncertainty in the airplane manufacturing market. Bank of America analysts said GE could be ""strongly positioned"" in the sector thanks to its variety of products and customers. GE Aerospace ( GE ) reports second-quarter earnings before markets open Tuesday, in what will be the aerospace parts maker's second earnings report since General Electric completed its split to three separate companies earlier this year. GE Aerospace is expected to report $8.5 billion in revenue, up from last year's $7.9 billion, according to estimates compiled by Visible Alpha. In its first quarter as a standalone company , GE Aerospace reported revenue of $8.1 billion, and raised its profit expectations for the full fiscal year, citing strong demand for its commercial and military airplane engines. GE Aerospace also said in its first-quarter report that it will begin offering more detailed breakdowns of its earnings starting in the second quarter, providing investors more insight into the performance of its two segments, ""Commercial Engines & Services"" and ""Defense & Propulsion Technologies."" GE Aerospace 'Strongly Positioned' To Benefit From Industry Growth Despite some uncertainty in the aerospace industry with Boeing ( BA ) experiencing safety issues and production slowdowns and Airbus ( AIR ) recently lowering its full-year guidance , Bank of America analysts wrote Wednesday that stocks of parts manufacturers like GE Aerospace are expected to weather the storm. ""We do not expect uncertainty to put significant downside risk on the commercial [ original equipment manufacturers ] in the quarter, as recent headlines have largely been priced into the stocks,"" the analysts wrote. Reiterating a ""buy"" rating with a price target of $180, the analysts wrote that GE could be ""strongly positioned"" to benefit from industry growth thanks to its ""unique portfolio,"" with revenue streams across aircraft manufacturers and aircraft types. The two other former divisions of General Electric, GE Vernova ( GEV ) and GE HealthCare ( GEHC ), are set to report their earnings on July 24 and July 31, respectively. GE Aerospace shares have gained close to 17% since the company completed its split from GE Vernova, at $159.13 as of Friday's close. Read the original article on Investopedia . View Comments Terms and Privacy Policy Privacy Dashboard More Info"
https://www.canberratimes.com.au/story/8701936/forging-pathways-for-young-mob-to-reach-the-sky/?cs=14264,,Forging pathways for young mob to reach the sky,20240719T223000Z,https://www.canberratimes.com.au/images/transform/v1/crop/frm/silverstone-feed-data/04233f3a-921c-47c1-9fc8-7ea3eaf2a4e6.jpg/r0_90_800_510_w1200_h630_fmax.jpg,canberratimes.com.au,English,Australia,ITA,Aerospace & Defense,aerospace,"Ad News Latest News Save Share News Latest News News Home Home / News / Latest News Forging pathways for young mob to reach the sky By Keira Jenkins Updated July 20 2024 - 7:31am , first published 7:30am By Keira Jenkins Updated July 20 2024 - 7:31am , first published 7:30am Save Share First Nations kids are being encouraged to take to the skies through a new program. Photo: HANDOUT/GUNGGANDJI AEROSPACE The sky will be the limit for students taking on a new program encouraging First Nations youth into aviation careers. Subscribe now for unlimited access . Login or signup to continue reading All articles from our website & app The digital version of Today's Paper Crosswords, Sudoku and Trivia All other regional websites in your area Continue Young people from remote and regional communities across north Queensland and the Torres Strait Islands will get hands-on experience with the aviation industry through Raising Horizons. The program, run by Indigenous aerospace consultancy Gunggandji Aerospace, is particularly focused on getting more First Nations girls into aviation, but is also open to boys. Gunggandji Aerospace founder and chief executive Daniel Joinbee said it's about showing the students what's possible in aviation. ""I want to change the narrative about what we're capable of doing,"" he told AAP. ""Get out into communities and talk to young kids about what are the opportunities and pathways into aviation and space, because it's not just being a pilot and it's not just being an astronaut."" Gunggandji Aerospace CEO Daniel Joinbee wants to show Indigenous kids what's possible in aviation. (HANDOUT/GUNGGANDJI AEROSPACE) Mr Joinbee is an air force veteran and Gunggandji man from the community of Yarrabah in far north Queensland. It was while consulting for Boeing that he realised there was a gap in the sector, prompting him to start the nation's only Indigenous-owned aerospace consultancy. The Raising Horizons program, which is set to begin in Townsville in January 2025, is a partnership between Gunggandji Aerospace, Rex Airlines and NRL Cowboys House, with funding from the federal government. The students will be connected with mentors throughout the program, something Mr Joinbee said is important to support them on their journey. ""One of the things that women in aviation already say is that there's a lack of mentors for emerging females in the industry to get behind them,"" he said. ""There will be males on the program as well and it's just as important for these young men to see that there are women in these leadership roles, because that's how we create holistic social change. ""It's not boys as fighter pilots and girls as crew attendants - everyone has a place in aviation and it is an exciting career that we can all actively participate in."" But Mr Joinbee said it's important to keep the young people engaged long after they've completed Raising Horizons. ""It's not just about the eight module program, and then we high-five the kids and say 'all the best, see you later',"" he said. ""There has to be follow-through, there has to be ongoing mentoring and there has to be a bigger sense of more."" Gunggandji Aerospace also facilitates ""non-traditional pathways"" into the aviation sector for young adults. Mr Joinbee said they're designed to help First Nations people who have not finished high school, have been incarcerated or are parents of young children to get into aviation and space industries. His vision is for aviation to be a viable career option for all First Nations people. ""I just want to see that aviation is seen as an accessible pathway for mob,"" he said. Australian Associated Press Save Share More from Latest News Typhoon brings floods to Taiwan, thousands evacuated 28m ago Ex-union boss allegedly threatened admin via emails 30m ago Supporters of neo-Nazi party to be 'exposed as racists' 48m ago Russia redress considered as embassy land ruling upheld 1hr ago As Australia welcomes its millionth refugee, its hardline border policies endure. We can lead by example again 1hr ago No comment s Former CFMEU boss charged after allegedly sending threatening emails 1hr ago Newsletters & Alerts View all Daily Your morning news Today's top stories curated by our news team. Also includes evening update. Loading... As it happens Public Service News Don't miss updates on news about the Public Service. Loading... Weekdays The lunch break Grab a quick bite of today's latest news from around the region and the nation. Loading... Weekdays The evening wrap Catch up on the news of the day and unwind with great reading for your evening. Loading... Weekly Subscriber Only Note from the Editor Get the editor's insights: what's happening & why it matters. Loading... Twice weekly The Senior Stay in the know on news that matters to you with twice weekly newsletters from The Senior. Loading... Weekly What's On Going out or staying in? Find out what's on. Loading... Daily Sport The latest news, results & expert analysis. Loading... Daily Subscriber Only Early Look At David Pope Your exclusive preview of David Pope's latest cartoon. Loading... Weekly Times Reader's Panel Join our weekly poll for Canberra Times readers. Loading... Weekly Weekend Reads We've selected the best reading for your weekend. Loading... Weekly Property Get the latest property and development news here. Loading... Weekly Explore Travel Every Saturday and Tuesday, explore destinations deals, tips & travel writing to transport you around the globe. Loading... Weekdays The Echidna Sharp. Close to the ground. Digging deep. Your weekday morning newsletter on national affairs, politics and more. Loading... Twice weekly The Informer Your essential national news digest: all the big issues on Wednesday and great reading every Saturday. Loading... As it happens Subscriber Only Special Reports Get the very best journalism from The Canberra Times by signing up to our special reports. Loading... Twice weekly Voice of Real Australia Get real, Australia! Let the ACM network's editors and journalists bring you news and views from all over. Loading... Weekly Motoring Get news, reviews and expert insights every Thursday from CarExpert, ACM's exclusive motoring partner. Loading... As it happens Breaking news alert Be the first to know when news breaks. Loading... Daily Subscriber Only Today's Paper Alert Your digital replica of Today's Paper. Ready to read from 5am! Loading... Daily Subscriber Only Your favourite puzzles Test your skills with interactive crosswords, sudoku & trivia. Fresh daily! Loading... Advertisement Ad Services near you Advertisement Ad Australian Community Media ACM Website Conditions of Use Privacy Terms and Conditions - Digital Subscription Terms and Conditions - Newspaper Subscription The Canberra Times Contact About Us Working With Us Today's Paper Commenting Guidelines Help Centre Newsletters App Our Sites View Insurance Beevo Place an Ad Local Business Directory Classifieds Jobs Tributes & Funerals Celebrations Promo Codes AgTrader MeHelp Farmer's Finance Garage Sales Zest Submit Send a Letter to the Editor Send Us Your News"
https://www.marketscreener.com/quote/stock/GE-AEROSPACE-4823/news/GE-Aerospace-Signs-UK-MOD-s-Defence-Aviation-Net-Zero-Charter-47424294/,,GE Aerospace : Signs united kingdom MOD Defence Aviation Net Zero Charter,20240719T181500Z,https://www.marketscreener.com/images/twitter_MS_fdblanc.png,marketscreener.com,English,,ITA,Aerospace & Defense,aerospace,"GE Aerospace : Signs UK MOD's Defence Aviation Net Zero Charter Published on 07/19/2024 at 01:52 pm EDT - Modified on 07/19/2024 at 01:53 pm EDT Publicnow Share GE Aerospace -0.39% GLOUCESTERSHIRE, England - July 19, 2024 - GE Aerospace (GE: NYSE) today signed the UK Ministry of Defence's (MOD) Defence Aviation Net Zero Charter. Scott Keating, Regional GM, Sales & Business Development, Europe for Defense & Systems with GE Aerospace joined Air Vice Marshal Shaun Harris CBE, Director Support and Chief Engineer Royal Air Force, to sign the charter at the Royal International Air Tattoo (RIAT). Through this Charter, GE Aerospace and partners will work together to capitalize on opportunities that improve operational effectiveness and support the MOD efforts in the Defence Aviation Net Zero Strategy . ""This marks a significant step forward in our efforts to collaborate and share best practices with our partners to ensure that defence aviation positively contributes to the UK Government's Net Zero ambitions and the Royal Air Force's aspirational goal to achieve Net Zero by 2040,"" said Keating. Shaun Harris added, ""Defence Aviation must be able to retain its ability to operate globally, to defend the UK and its allies in a changing climatic environment, whilst also significantly reducing our own carbon emissions. Strong collaboration with industry is essential in that work, so the Royal Air Force is delighted that GE Aerospace has become the latest signatory to the UK Defence Aviation Net Zero Charter."" ""We are honoured to join the UK MOD's Defence Aviation Net Zero Charter. This partnership underscores our support of the UK's Net Zero ambitions"", said Amy Gowder, President and CEO, Defense & Systems with GE Aerospace. ""By collaborating with our partners and sharing best practices, we aim to advance technology innovations that reduce emissions while enhancing the effectiveness of defence aviation operations."" About GE Aerospace GE Aerospace (NYSE:GE) is a global aerospace propulsion, services, and systems leader with an installed base of approximately 44,000 commercial and 26,000 military aircraft engines. With a global team of 52,000 employees building on more than a century of innovation and learning, GE Aerospace is committed to inventing the future of flight, lifting people up, and bringing them home safely. Learn more about how GE Aerospace and its partners are defining flight for today, tomorrow and the future at www.geaerospace.com . In the UK, GE Aerospace's footprint spans maintenance, repair, and overhaul of aircraft engines (MRO) at sites in Scotland and South Wales, to propeller, electrical power & avionics systems businesses across Gloucester and Cheltenham. Pioneering technologies and capabilities are ubiquitous across the UK's key defence platforms, including programmes such as the Mk2 AH-64-E Apache, C-130J, Eurofighter Typhoon and F-35 programmes, Boeing P-8 Poseidon, and E-7 Wedgetail. # # # Media Contact: GE Aerospace Mandy Mayfield [email protected] +1.321.442.1259 Attachments Original Link Permalink Disclaimer GE Aerospace - General Electric Company published this content on 19 July 2024 and is solely responsible for the information contained therein. Distributed by Public , unedited and unaltered, on 19 July 2024 17:52:09 UTC . © Publicnow - 2024 Share"
https://www.marketscreener.com/quote/stock/GE-AEROSPACE-4823/news/GE-Aerospace-Investing-1-Billion-to-Expand-and-Upgrade-MRO-Facilities-Worldwide-47422173/,,GE Aerospace Investing $1 Billion to Expand and Upgrade MRO Facilities Worldwide,20240719T121500Z,https://www.marketscreener.com/images/twitter_MS_fdnoir.png,marketscreener.com,English,,ITA,Aerospace & Defense,aerospace,"GE Aerospace Investing $1 Billion to Expand and Upgrade MRO Facilities Worldwide Investment will support customers’ fleets by increasing capacity and improving turnaround times Published on 07/19/2024 at 07:55 am EDT - Modified on 07/19/2024 at 07:56 am EDT Business Wire Share GE Aerospace -0.39% GE Aerospace (NYSE:GE) announced plans to invest more than $1 billion over five years in its Maintenance, Repair and Overhaul (MRO) and component repair facilities worldwide. These investments will help GE Aerospace create capacity to meet growth in both the widebody and narrowbody installed base by adding additional engine test cells and equipment. The funding also will add cutting-edge technology, including enhanced inspection techniques, to reduce turnaround times for customers as well as expand component repair capability within its overhaul shops. GE Aerospace President and CEO, Commercial Engines and Services, Russell Stokes said, “Our customers are experiencing strong air travel demand, and we are investing to increase our capacity and efficiency so we can meet their growing needs and keep their planes flying safely and reliably. With this major investment, we are reinforcing our longstanding focus on safety, quality, and delivery for our customers and the flying public.” The largest portion of the investment will support growing demand for CFM LEAP* engines as the fleet continues to mature and expand with more than 3,300 LEAP-powered aircraft in service and more than 10,000 additional engines currently in backlog, increasing the global commercial airline fleet by thousands of planes in the coming years. Many of these investments are being made as the result of employees working to improve safety, quality, delivery and cost, through FLIGHT DECK, GE Aerospace’s proprietary lean operating model – a systematic approach to running the business to deliver exceptional value as measured through the eyes of customers. Global MRO Investments to Support Customers Across Engine Portfolio A major part of the MRO funding this year provides for construction of a new Services Technology Acceleration Center (STAC) near Cincinnati, Ohio. Opening in September 2024, STAC will help accelerate the deployment of innovative services approaches, including inspection technologies that detect emerging issues sooner and reduce airplane downtime for customers. In total, GE Aerospace regional repair and overhaul facilities across the globe will receive $250 million in 2024 of the $1 billion planned five-year investment to help fund facilities expansion, new machines, tooling, and safety enhancements, including: United States: ~$65M Cincinnati, Ohio; McAllen, Texas; Lafayette, Indiana; Dallas, Texas; Winfield, Kansas South America: ~$55M Petropolis, Brazil Europe and Middle East: ~$60M Budapest, Hungary; Prestwick, Scotland; London, England; Cardiff, Wales; Wroclaw, Poland; Doha, Qatar; Dubai, United Arab Emirates Asia Pacific: ~$45M Singapore; Taipei, Taiwan; Kuala Lumpur Malaysia; Seoul, South Korea GE Aerospace’s MRO facilities keep more than 40,000 commercial aircraft engines flying. Customer services include engine disassembly and reassembly, maintenance, repair, and inspection, as well as testing. *CFM International is a 50/50 joint venture between GE Aerospace and Safran Aircraft Engines. LEAP is a registered trademark of CFM. About GE Aerospace GE Aerospace (NYSE:GE) is a global aerospace propulsion, services, and systems leader with an installed base of approximately 44,000 commercial and 26,000 military aircraft engines. With a global team of 52,000 employees building on more than a century of innovation and learning, GE Aerospace is committed to inventing the future of flight, lifting people up, and bringing them home safely. Learn more about how GE Aerospace and its partners are defining flight for today, tomorrow and the future at www.geaerospace.com . View source version on businesswire.com: https://www.businesswire.com/news/home/20240719740240/en/ © Business Wire - 2024 Share"
https://www.newswire.ca/news-releases/altair-to-showcase-cutting-edge-ai-powered-engineering-at-farnborough-international-airshow-2024-864180118.html,,Altair to Showcase Cutting - Edge AI - Powered Engineering at Farnborough International Airshow 2024,20240718T140000Z,,newswire.ca,English,Canada,ITA,Aerospace & Defense,aerospace,"Live technology demos to focus on solutions in aerospace design, production, and maintenance TROY, Mich. , July 18, 2024 /CNW/ -- Altair (Nasdaq: ALTR), a global leader in computational intelligence, will showcase its latest innovations in engineering simulation , artificial intelligence (AI), and high-performance computing (HPC) at the Farnborough International Airshow 2024 , taking place July 22 to July 26 at the Farnborough International Exhibition and Conference Centre, U.K. Altair solutions are transforming aerospace engineering and production processes. Continue Reading Altair to showcase latest innovations in engineering simulation, artificial intelligence (AI), and high-performance computing (HPC) at the Farnborough International Airshow 2024, taking place July 22 to July 26. Attendees will have the opportunity to explore Altair's AI-powered engineering solutions, which support the entire aerospace life cycle, from conceptual design and manufacturing to operational performance and maintenance, repair, and overhaul (MRO). Altair will also share insights on sustainable aviation, the smart factory, advanced connectivity, and digital engineering efficiency. Highlights of Altair's participation at the Farnborough Airshow 2024 include: Sustainable Aviation through AI-Powered Engineering Simulation Demos: Altair's AI-powered simulation solutions enable aerospace engineers to solve complex design challenges. By integrating AI into design and simulation technologies, Altair provides unprecedented insights and performance improvements for aircraft design and operations. Efficient Manufacturing and MRO with Intelligent Digital Twins Demos: Altair solutions utilize design and operational data to create intelligent digital twins that enable real-time monitoring and predictive maintenance, helping aerospace companies improve safety, reduce costs, and extend the life cycle of their aircraft. Digital Superiority for Defense Demos: For government agencies, primes, and defense companies, Altair will showcase solutions to navigate the evolving digital landscape, build solutions at speed, take data-driven decisions, and deliver programs on time and on budget. Supporting the Future of Aerospace: Altair's Aerospace Startup Acceleration Program is a unique offering that gives startups leading design and data analytics solutions that help them succeed in a today's competitive global market. ""The power of computational intelligence is critical to moving the aerospace industry forward with improvements in safety and reducing environmental impact,"" said Dr. Pietro Cervellera , senior vice president of aerospace and defense, Altair. ""Altair is the only company that provides the data science and rocket science know-how to take this industry to the next level. We are excited to show our commitment to advancing the future of aviation through our innovative, intuitive, AI-powered engineering solutions."" Altair will be at booth 1116 in hall 1. For more information about Altair's participation at the Farnborough International Airshow 2024, visit https://events.altair.com/farnborough-air-show-2024/ . To learn more about Altair's aerospace solutions, visit https://altair.com/aerospace-and-defense . About Altair Altair is a global leader in computational intelligence that provides software and cloud solutions in simulation, high-performance computing (HPC), data analytics, and AI. Altair enables organizations across all industries to compete more effectively and drive smarter decisions in an increasingly connected world – all while creating a greener, more sustainable future. To learn more, please visit www.altair.com . Media contacts Altair Corporate Altair Investor Relations Bridget Hagan Stephen Palmtag +1.216.769.2658 +1.669.328.9111 [email protected] [email protected] Altair Europe/The Middle East/Africa Charlotte Hartmann +49 7031 6208 0 [email protected] SOURCE Altair × Modal title"
