url,url_mobile,title,seendate,socialimage,domain,language,sourcecountry,ticker,industry,search_keyword,article_text
https://menafn.com/1108637691/Bye-Aerospace-Begins-Initial-Build-Of-First-Eflyer-2-All-Electric-Conventional-Aircraft,,Bye Aerospace Begins Initial Build Of First Eflyer 2 - All - Electric Conventional Aircraft,20240905T003000Z,https://menafn.com/updates/pr/2024-09/04/PN_9cc87image_story.jpg,menafn.com,English,Qatar,ITA,Aerospace & Defense,aerospace,Severe Storm Cause Widespread Damage On Greece's Northeast Islands
https://news.fullerton.edu/2024/09/5-million-nasa-grant-launches-csuf-aerospace-research-center/,,$5 Million NASA Grant Launches CSUF Aerospace Research Center,20240904T231500Z,http://news.fullerton.edu/app/uploads/2024/09/112415main_image_feature_302_ajh_full.jpg,news.fullerton.edu,English,United States,ITA,Aerospace & Defense,aerospace,"A rocket launches from launchpad. (Courtesy of Adobe Stock/Ryan Chylinski) Cal State Fullerton has been awarded a nearly $5 million NASA grant to launch the new SpaceIgnite Center for Advanced Research-Education in Combustion to prepare a diverse workforce in the aerospace industry. As part of the grant project, the SPARC Center will build capacity in aerospace research to support future space exploration missions and boost the number of underrepresented students in STEM careers, said Haowei Wang , professor of mechanical engineering, who is directing the grant project. The SPARC Center will introduce students to the aerospace industry through new courses and participation in research experiences at CSUF, Clemson University and the University of Washington. Students will also have the opportunity to intern at the NASA Glenn Research Center and engage in activities with industry partners to develop professional networks. Haowei Wang, professor of mechanical engineering According to the Bureau of Labor Statistics, the global aerospace market is projected to grow from $321.5 billion in 2022 to $678.17 billion by 2032, Wang shared. “A tremendous number of new career openings will arise in this field, such as the application of sustainable aviation fuels,” he said. “Southern California is a hub for the aerospace industry with companies such as Boeing and SpaceX. Our students will have a unique advantage in seizing these job opportunities.” Plans also include creating a focus area in aerospace engineering for the university’s bachelor’s degree program in mechanical engineering and building a pipeline for students to enter doctoral programs at the two partner institutions and other top-tier research universities. Additionally, the center will offer research experiences to STEM (science, technology, engineering and mathematics) students at Santiago Canyon College and encourage them to transfer to CSUF. “These efforts will help increase the number of underrepresented students who earn a STEM degree, propel interest in careers at NASA or the aerospace industry and diversify the workforce,” Wang said. Co-directing the five-year grant project, which starts Oct. 1, are CSUF’s Chean Chin Ngo, chair and professor of mechanical engineering; Jidong Huang, chair and professor of electrical and computer engineering; and Megan Drangstveit, director of Project RAISE . The Department of Mechanical Engineering in the College of Engineering and Computer Science currently offers several aerospace-related courses such as Aerodynamics, Propulsion Systems and Combustion, Wang said. The SPARC Center plans to build upon the curriculum by developing new courses in space technology, space flight, orbital mechanics and thermodynamics, which relate to the properties of gas mixtures and combustion processes. High-pressure combustion and supercritical oxidation research is essential in the aerospace industry to optimize the performance of aircraft and space vehicles, explained Wang, whose research interests focus on combustion and education. “Our research aims to better understand the injection and mixing process of supercritical fluids to improve aircraft engine efficiency at high pressures,” he said. CSUF students will conduct aerospace research at the NASA Glenn Research Center. (Courtesy of NASA) At the NASA Glenn Research Center, faculty and students will have access to the Cleveland, Ohio, facility to learn about supercritical water oxidation reclamation. With this new technology, reclaimed water secures the water supply for long-duration space exploration missions, Wang said. Wang hopes that these efforts will spark student interest in the aerospace field and ignite their future careers. “I am confident that through the SPARC Center, students will learn about leading technology in the aerospace industry, acquire technical skills and develop an innovative spirit to become leaders in the aerospace industry.” The NASA award was made possible through the Minority University Research and Education Project Institutional Research Opportunity (MIRO) grant, funded by the agency’s Office of Science, Technology, Engineering and Mathematics Engagement."
http://english.www.gov.cn/news/202408/28/content_WS66cf2c2ac6d0868f4e8ea4ed.html,,China develops aerospace curriculum for primary and middle school students,20240828T151500Z,,english.www.gov.cn,English,China,ITA,Aerospace & Defense,aerospace,"App HOME NEWS INSTITUTIONS POLICIES ARCHIVE 中文 HOME NEWS INSTITUTIONS POLICIES ARCHIVE 中文 China develops aerospace curriculum for primary and middle school students Updated: August 28, 2024 21:54 Xinhua BEIJING, Aug. 28 -- China has developed an aerospace science and technology curriculum that primary and middle school students can use both in and out of class. The China Association of Children's Science Instructors, universities such as Beihang University and Tsinghua University, and some aerospace experts, collaborated to develop and design the curriculum. Containing 224 aviation sci-tech courses and 224 aerospace sci-tech courses, the curriculum incorporates multiple subjects such as science, technology, engineering, arts and mathematics. The curriculum was designed to cultivate students' abilities to explore, practice and think creatively, as well as encourage their interest in aerospace and promote scientific literacy. Copyright© www.gov.cn | About us | Contact us Website Identification Code bm01000001 Registration Number: 05070218 All rights reserved. The content (including but not limited to text, photo, multimedia information, etc) published in this site belongs to www.gov.cn. Without written authorization from www.gov.cn, such content shall not be republished or used in any form. Mobile Desktop Copyright© www.gov.cn | Contact us Website Identification Code bm01000001 Registration Number: 05070218"
https://www.prnewswire.com/news-releases/century-fasteners-corp-exhibiting-at-the-2024-international-fastener-expo-302231963.html,,Century Fasteners Corp . Exhibiting at the 2024 International Fastener Expo,20240827T201500Z,,prnewswire.com,English,United States,ITA,Aerospace & Defense,aerospace,"Century Fasteners Corp. and Cherry Aerospace Relationship Showcased at the International Fastener Expo, in Las Vegas, NV , on September 9th – 11th, 2024. ELMHURST, N.Y. , Aug. 27, 2024 /PRNewswire/ -- Century Fasteners Corp . ( www.CenturyFasteners.com ) is an authorized distributor for Cherry Aerospace ( www.CherryAerospace.com ). The Century Fasteners Corp. and Cherry Aerospace relationship is to be showcased at the International Fastener Expo in Las Vegas, NV on September 9 th -11 th , 2024 Booth #1162 For more info about the Event, please go to: International Fastener Expo In addition to making world-class Cherry products more broadly available to distributors and OEMs, the partnership expands Century's existing services to the manufacturing community by enabling the company to provide deeper bill of material coverage to complement its product offering. About Century Fasteners Century Fasteners Corp. is a Master Distributor of fastener and non-fastener components to the military, aerospace, electronics, automotive, sheet metal fabrication, contract manufacturing, telecommunications and medical industries. The ISO and AS Registered company stocks more than 100,000 discrete parts, and offers a wide variety of value-added services, including VMI in-plant programs, custom kitting, engineering services, and supply chain management solutions. Service, Inventory, Integrity For Cherry Aerospace product quotes for Distributors, email the requirements to Century Fasteners Corp. at [email protected] . To learn more about the products and services offered by Century Fasteners Corp., visit us online at www.CenturyFasteners.com . About Cherry Aerospace Headquartered in Santa Ana, CA , Cherry Aerospace is a global leader in the design and manufacture of fastening systems for the aerospace industry. The Cherry® name is synonymous with aerospace fasteners, and the CherryMax® line of rivets is the most widely used in the industry. Cherry® Aerospace is well known for their industry leading blind rivets, blind bolts, rivetless nut plates, shear pin fasteners and installation tools. The company is a member of the SPS Fastener Division of Precision Castparts Corp. Media contact: John Ringold Century Fasteners Corp. / Director of Marketing 800-221-0769 [email protected] https://www.centuryfasteners.com/ Contact: ***@optonline.net Photo(s): https://www.prlog.org/13035608 Press release distributed by PRLog SOURCE Century Fasteners Corp. 21 % more press release views with Request a Demo × Modal title"
https://www.marketscreener.com/quote/stock/GE-AEROSPACE-4823/news/Apprentices-Graduate-from-GE-Aerospace-Rutland-Program-Apprenticeship-program-marking-50th-annivers-47741075/,,Apprentices Graduate from GE Aerospace Rutland Program ; Apprenticeship program marking 50th anniversary,20240827T151500Z,https://www.marketscreener.com/images/twitter_MS_fdnoir.png,marketscreener.com,English,,ITA,Aerospace & Defense,aerospace,"Apprentices Graduate from GE Aerospace Rutland Program; Apprenticeship program marking 50th anniversary Published on 08/27/2024 at 10:57 am EDT - Modified on 08/27/2024 at 10:58 am EDT Acquiremedia Share GE Aerospace -0.39% Rutland, Vt . - Nine apprentices graduated from the Advanced Machinist | Toolmaker Apprentice Program at GE Aerospace's site in Rutland, Vt ., after three years of learning machining and manufacturing skills while attending technical classes. This year's graduating class marks the 50th anniversary of the Rutland apprenticeship program. More than 348 individuals have graduated since the program's inception, giving local residents the opportunity to gain a good-paying manufacturing job. 'Through a combination of hands-on learning and fully subsidized classes, our apprentices have the knowledge and skills they need to thrive in the workforce. They are the future of GE Aerospace and Rutland ,' said Dan Shelley , site leader for GE Aerospace's Rutland site which produces compressor blades and vanes for almost every jet engine in GE Aerospace's product line. A ceremony last Friday with the apprentices, their families and site leaders celebrated the milestone. All graduates will continue in full-time positions. 'Being able to further our education free of cost and lay the groundwork for career advancement-all while simultaneously earning a living-has been such a beneficial opportunity,' said Cassidy Yrsha , one of the graduates. 'I hope to continue expanding on the foundation our mentors have helped us build.' 'The apprenticeship was incredibly rewarding', said Ethan Pieper , another graduate. 'I've learned so much not just about machining but about leadership, collaboration and work ethic. I cannot wait for what is ahead.' GE Aerospace Rutland Program GE Aerospace pays for the 14 classes of instruction apprentices receive through Vermont State University . Concurrently, apprentices gain 6,000 hours of on-the-job training at the Rutland site. Mentors with decades of experience guide the apprentices in building expertise in highly technical machining practices and skills with foundational manufacturing equipment. Rutland's apprenticeship program supports GE Aerospace's long-term efforts to strengthen the manufacturing talent pipeline and invest in GE Aerospace employees. 'Kids and adults alike can look at these graduates and see a clear pathway to building an amazing career in manufacturing right here in Rutland . We are grateful that GE Aerospace continues to invest in our people and community through this apprenticeship program,' said Lyle Jepson , Executive Director of the Chamber & Economic Development of the Rutland Region . Rutland also offers additional structured training programs that include credited classes. These programs include a Maintenance Apprentice Program as well as technical Masters programs, where individuals can gain advanced skills in automation technology programming, inspection technology and numerical control programming. The Rutland apprenticeship programs are some of many skills training efforts GE Aerospace offers across its U.S. and global operations. In 2024, more than 800 individuals will take part in a GE Aerospace program or sponsored effort for individuals to gain skills needed in aerospace manufacturing. Earlier this year, GE Aerospace announced plans to invest $24.9 million into the Rutland site. The investment will go for new equipment, machines and tooling support to increase production of commercial aircraft engines, along with military and fighters jet engines. About GE Aerospace GE Aerospace (NYSE:GE) is a global aerospace propulsion, services, and systems leader with an installed base of approximately 44,000 commercial and 26,000 military aircraft engines. With a global team of 52,000 employees building on more than a century of innovation and learning, GE Aerospace is committed to inventing the future of flight, lifting people up, and bringing them home safely. Learn more about how GE Aerospace and its partners are defining flight for today, tomorrow and the future at www.geaerospace.com. For Media Inquiries, please contact: Patricia Minichiello (C) 2024 Electronic News Publishing, source ENP Newswire © Acquiremedia - 2024 Share"
https://www.foxnews.com/tech/spaceplane-breaks-barriers-reaching-incredible-heights-speeds,https://www.foxnews.com/tech/spaceplane-breaks-barriers-reaching-incredible-heights-speeds.amp,"A spaceplane breaks barriers , reaching incredible heights and speeds",20240827T104500Z,https://static.foxnews.com/foxnews.com/content/uploads/2024/08/1-A-spaceplane-breaks-barriers-reaching-incredible-heights-and-speeds.jpg,foxnews.com,English,United States,ITA,Aerospace & Defense,aerospace,"close Video 'CyberGuy': Spaceplane breaks barriers, reaching incredible heights, speeds Tech expert Kurt Knutsson explains how Dawn Aerospace is advancing a reusable spaceplane to make space travel more affordable. NEW You can now listen to Fox News articles! Dawn Aerospace, based in Christchurch, New Zealand, is making waves in the aerospace industry with its groundbreaking approach to creating a reusable spaceplane. But why should this matter to you? Imagine a future where space travel is as routine and affordable as flying across the country. This is the vision Dawn Aerospace is working towards, and its recent achievements bring us one step closer to that reality. GET SECURITY ALERTS, EXPERT TIPS - SIGN UP FOR KURT’S NEWSLETTER - THE CYBERGUY REPORT HERE Uncrewed Mk-II rocket-powered spaceplane (Dawn Aerospace) (Kurt ""CyberGuy"" Knutsson) Major advances in spaceplane technology Dawn Aerospace's latest test flight , conducted as part of its Campaign 2-2 development program, saw its uncrewed Mk-II rocket-powered aircraft reach transonic speeds of Mach 0.92 and an altitude of 50,000 feet. This achievement represents a substantial enhancement in performance, with improvements of three to five times compared to previous metrics. The company is now ready to begin Campaign 2-3 in September, where it hopes to achieve supersonic flight for the first time. The overarching goal is to create a spaceplane that combines the performance of a first-stage rocket with the predictability and rapid turnaround of a conventional aircraft. KURT’S PICKS: EARLY LABOR DAY DEALS Uncrewed Mk-II rocket-powered spaceplane (Dawn Aerospace) (Kurt ""CyberGuy"" Knutsson) NASA'S DRAGONFLY DRONE CLEARED FOR FLIGHT FOR SATURN'S MOON, TITAN The vision behind Dawn Aerospace The philosophy behind Dawn Aerospace's development strategy is reminiscent of NASA's X-15 program from the 1950s and 1960s. The company focuses on incrementally developing the spaceplane by starting with a conventional aircraft design and progressively enhancing its performance and capabilities with each campaign cycle. This method allows the aircraft to take off and land from a runway like a traditional plane while gradually incorporating advanced technology. Campaign 2-2 was a big success for Dawn Aerospace, with three flights achieving all their goals. Now, they're gearing up for Campaign 2-3, which will use the Mk-IIA aircraft. This plane is expected to break the sound barrier and confirm that the design works well at different speeds and altitudes. After that, they'll move on to the Mk-IIB, which will have more power, 10% more thrust and 30% more total impulse than before. HOW TO REMOVE YOUR PRIVATE DATA FROM THE INTERNET Uncrewed Mk-II rocket-powered spaceplane (Dawn Aerospace) (Kurt ""CyberGuy"" Knutsson) THE RACE TO FLOAT TOURISTS TO THE EDGE OF SPACE IS HEATING UP Future goals and aspirations Dawn Aerospace has set ambitious targets for its Mk-II spaceplane. By the end of 2025, the company hopes to climb faster than an F-15, fly higher than a MiG-25 and exceed speeds greater than the SR-71 Blackbird. Additionally, they aspire to be the first vehicle to fly above the Karman line, defined as 62 miles altitude, twice in a single day. Many of these records have stood for over 50 years, highlighting the ambitious nature of their goals. The company has invested approximately $10 million in the program so far and plans to complete it for under $20 million in total. Dawn Aerospace's rapid progress through flight testing, compared to other rocket development programs, can be attributed to its core philosophy and design methodology. This approach allows the company to move quickly and confidently through flight tests while minimizing risks. ALERT: 4.3 MILLION AMERICANS EXPOSED IN MASSIVE HEALTH SAVINGS ACCOUNT DATA BREACH Uncrewed Mk-II rocket-powered spaceplane (Dawn Aerospace) (Kurt ""CyberGuy"" Knutsson) SUIT UP FOR THE STARS: SPACEX'S NEW ERA OF SPACE FASHION The philosophy of design Dawn Aerospace's founders, with backgrounds in traditional rocketry and aviation, have designed the Mk-II to embody the properties of an aircraft: rapid reusability, high reliability and low operational costs. This philosophy enables the company to maintain these characteristics throughout the flight test program, allowing for a high flight cadence that fosters rapid testing, iteration and learning. Every design decision made by Dawn Aerospace prioritizes an aircraft's essential properties, such as using standard runways, employing storable propellant engines and ensuring quick turnaround times. Achieving an aircraft standard is challenging but ultimately unlocks a development path that has historically propelled aviation advancements. By approaching the Mk-II as an aircraft with rocket-like performance, Dawn Aerospace can take measured risks in quick succession, allowing for precise adjustments based on high-fidelity flight test data. This methodology has proven effective, saving the company from extensive delays and setbacks often associated with traditional rocket development. SUBSCRIBE TO KURT’S YOUTUBE CHANNEL FOR QUICK VIDEO TIPS ON HOW TO WORK ALL OF YOUR TECH DEVICES Flight profile of uncrewed Mk-II rocket-powered spaceplane (Dawn Aerospace) (Kurt ""CyberGuy"" Knutsson) Kurt's key takeaways Dawn Aerospace's innovative approach to spaceplane development has the potential to revolutionize the aerospace industry. By blending the operational characteristics of aircraft with the performance capabilities of rockets, the company is set to make space more accessible and affordable. As they continue to push the boundaries of aerospace technology, the implications for commercial space travel and satellite deployment could be profound. The success of their upcoming campaigns will be closely watched by the world, and we will, of course, keep you updated as they may set new standards for the future of flight. Would you want to take a trip on a reusable spaceplane like Dawn Aerospace's Mk-II, potentially reaching supersonic speeds and soaring above 62 miles into space? Let us know by writing us at Cyberguy.com/Contact . For more of my tech tips and security alerts, subscribe to my free CyberGuy Report Newsletter by heading to Cyberguy.com/Newsletter . Ask Kurt a question or let us know what stories you'd like us to cover . Follow Kurt on his social channels: Facebook YouTube Instagram Answers to the most asked CyberGuy questions: What is the best way to protect your Mac, Windows, iPhone and Android devices from getting hacked? What is the best way to stay private, secure and anonymous while browsing the web? How can I get rid of robocalls with apps and data-removal services? How do I remove my private data from the internet? New from Kurt: Try CyberGuy's new games (crosswords, word searches, trivia and more!) Get Kurt’s early Labor Day deals Copyright 2024 CyberGuy.com. All rights reserved. Kurt ""CyberGuy"" Knutsson is an award-winning tech journalist who has a deep love of technology, gear and gadgets that make life better with his contributions for Fox News & FOX Business beginning mornings on ""FOX & Friends."" Got a tech question? Get Kurt’s free CyberGuy Newsletter, share your voice, a story idea or comment at CyberGuy.com. Get a daily look at what’s developing in science and technology throughout the world. Arrives Weekly Subscribe Subscribed Subscribe You've successfully subscribed to this newsletter!"
