url,url_mobile,title,seendate,socialimage,domain,language,sourcecountry,ticker,industry,search_keyword,article_text
https://www.geo.tv/latest/560711-unlock-the-sky,,Unlock the sky,20240824T090000Z,https://www.geo.tv/assets/uploads/updates/2024-08-24/l_560711_084813_updates.jpg,geo.tv,English,Pakistan,ITA,Aerospace & Defense,aerospace,"Home latest pakistan world sports showbiz entertainment Royal Hollywood business health Sci-Tech Food Fact Check big picture Videos shows Watch Unlock the sky Globally, aerospace and defence industry commands an impressive annual market of $697 billion By Imran Jattala | August 24, 2024 A representational image of the iCube Qamar in space seen in this still taken from a video. — CGTN The aerospace industry represents the pinnacle of innovation, driving both technological advancement and economic growth. As artificial intelligence (AI) and information and communications technology (ICT) continue to evolve, Pakistan finds itself at a critical juncture of economic transformation. Aerospace tech presents a high-growth avenue. In a groundbreaking collaboration, Ignite NTF, the Ministry of Information Technology and Telecommunications (MoIT&T), and the National Aerospace Science and Technology Park (NASTP) have established a dedicated Aerospace and ICT Innovation Centre. Advertisement This centre, the National Incubation Centre for Aerospace Technologies (NICAT), is the region's first Aerospace & DeepTech Incubation centre, reshaping the country's aerospace and deep-tech landscape. Globally, the aerospace and defence industry commands an impressive annual market of $697 billion, with commercial aerospace valued at $298 billion. Boeing forecasts a demand for over 43,500 new airplanes worth $7.2 trillion by 2040, underscoring a substantial growth opportunity. However, Pakistan's current metrics reveal considerable untapped potential. For example, the cost of a flight per mile in Pakistan is $0.064, compared to $0.049 in neighbouring countries. Additionally, Pakistan's aircraft seats per person ratio is 0.03, compared to India's 0.16, Nepal's 0.11, and Bangladesh's 0.04. To address these challenges and harness the opportunities, Pakistan has outlined comprehensive policies. The National Aviation Policy aims to advance the aerospace sector through technology and innovation, enhancing infrastructure, regulatory reforms, and research initiatives. The National Space Policy complements this by focusing on developing indigenous satellite technology for improved communication, Earth observation, and navigation systems. It promotes public-private partnerships to drive innovation and investment while emphasising international collaboration to access advanced technologies and research. The NASTP exemplifies this commitment. As a nationwide network of science and technology parks, NASTP aims to elevate the aerospace sector through advanced research and collaboration, attracting global aerospace companies and research institutions. It seeks to become a hub for cutting-edge aerospace technologies, supporting the development of new materials, systems, and solutions. By integrating industry leaders, government bodies, and academic institutions, the NASTP drives scientific advancement, stimulates economic growth and creates high-tech jobs. Parallel to this, the NICAT is set to leverage Pakistan's aerospace potential. NICAT, focusing on aerospace, deep-tech, and ICT, provides access to specialised equipment, advanced production facilities, R and D labs, and a global marketing network. Its goal is to stimulate growth in Pakistan's aerospace and high-tech manufacturing sectors, akin to Vietnam's economic transformation, which saw high-tech exports rise from 10% to over 40% of total manufactured exports within a decade. The potential of aerospace technologies to address challenges in mobility, healthcare, agriculture, and emergency services is immense. In the mobility sector, advancements such as Urban Air Mobility (UAM) and enhanced satellite navigation systems can revolutionise transportation in cities like Karachi and Lahore. These technologies promise to alleviate congestion and improve travel efficiency. In healthcare, aerospace innovations in medical imaging, telemedicine, and air ambulances can significantly enhance diagnostic capabilities and emergency medical services, especially in remote areas. In agriculture, remote sensing technologies and aerial spraying can optimise crop management and increase yields, benefiting Pakistani farmers. Aerospace technology also plays a crucial role in emergency services by improving search and rescue operations and disaster response through advanced satellite monitoring and drones. Recent advances in space technology highlight this potential. The successful launch of ICUBE-Qamar, Pakistan's first lunar mission, aboard China's Chang'E-6, showcases the country's growing capabilities in space exploration. This mission, aimed at lunar surface imaging and magnetic field data collection, underscores the need for a comprehensive space policy to guide future initiatives. International examples highlight the impact of public-private partnerships in advancing aerospace technology. India's collaboration between the Indian Space Research Organisation (ISRO) and private companies has led to innovations such as the Mars Orbiter Mission and Chandrayaan-3. China's space programme, through partnerships with private firms, has achieved milestones in lunar exploration and satellite technology. Similarly, Turkey's partnership with Turkish Aerospace Industries has enhanced its capabilities in unmanned aerial vehicles (UAVs) and satellite technology. These global examples demonstrate how public-private partnerships can drive technological innovation and economic growth. Pakistan should adopt a similar strategy, leveraging NICAT and other initiatives to advance collaboration among government, academia, and industry. This approach will enhance Pakistan's strategic position and stimulate economic growth through high-tech innovation. The aerospace sector presents immense opportunities for Pakistan. Continued state investment, a supportive policy framework, and a focus on high-tech sectors, particularly aerospace and space technology, will drive sustainable economic growth. NICAT and the ICUBE-Q mission highlight the transformative potential of innovation and international collaboration. By embracing public-private partnerships and prioritising high-tech manufacturing, Pakistan can secure its place at the forefront of technological advancement and economic development, alongside its international counterparts. The writer is project director at the National Incubation Center for Aerospace Technologies (NICAT). Disclaimer: The viewpoints expressed in this piece are the writer's own and don't necessarily reflect Geo.tv's editorial policy. Originally published in The News Advertisement Capitalism reborn – again Article 243 Reclaiming Iqbal's vision Space for change"
https://www.marketscreener.com/quote/stock/HOWMET-AEROSPACE-INC-104922916/news/Howmet-Aerospace-to-Present-at-Jefferies-Industrials-Conference-47713462/,,Howmet Aerospace to Present at Jefferies Industrials Conference,20240822T143000Z,https://www.marketscreener.com/images/twitter_MS_fdblanc.png,marketscreener.com,English,,ITA,Aerospace & Defense,aerospace,"Howmet Aerospace to Present at Jefferies Industrials Conference Published on 08/22/2024 at 10:08 am EDT - Modified on 08/22/2024 at 10:09 am EDT Business Wire Share Howmet Aerospace Inc. -0.40% Howmet Aerospace Inc. (NYSE: HWM) announced today that John C. Plant, Chairman and Chief Executive Officer, and Ken Giacobbe, Executive Vice President and Chief Financial Officer, will speak at the Jefferies Industrials Conference on Thursday, September 5, 2024, at 10:25 AM ET. A real-time webcast of the event will be available on the “Investors/Events and Presentations” section of www.howmet.com , where a webcast replay will be available for 90 days following the presentation. About Howmet Aerospace Howmet Aerospace Inc., headquartered in Pittsburgh, Pennsylvania, is a leading global provider of advanced engineered solutions for the aerospace and transportation industries. The Company’s primary businesses focus on jet engine components, aerospace fastening systems, and airframe structural components necessary for mission-critical performance and efficiency in aerospace and defense applications, as well as forged wheels for commercial transportation. With approximately 1,150 granted patents, the Company’s differentiated technologies enable lighter, more fuel-efficient aircraft and commercial trucks to operate with a lower carbon footprint. For more information, visit www.howmet.com . Dissemination of Company Information Howmet Aerospace intends to make future announcements regarding Company developments and financial performance through its website at www.howmet.com . View source version on businesswire.com: https://www.businesswire.com/news/home/20240822627632/en/ © Business Wire - 2024 Share"
https://www.globalsecurity.org/wmd/library/news/brazil/brazil-240821-dod01.htm,,Readout of 7th U . S .- Brazil Strategic Defense Talks,20240822T130000Z,,globalsecurity.org,English,Syria,ITA,Aerospace & Defense,defense,"August 21, 2024 Release Readout of 7th U.S.-Brazil Strategic Defense Talks In-Depth Coverage Department of Defense Spokesman Lt. Col. Devin T. Robinson provided the following readout: On August 20, 2024, Deputy Assistant Secretary of Defense (DASD) for Western Hemisphere Affairs Ms. Jana Nelson chaired the 7th U.S.-Brazil Strategic Defense Talks with Rear Admiral Fernando De Luca Marques de Oliveira, Chief, International Affairs Section, Brazilian Ministry of Defense. The meeting took place at the Pentagon in Washington, D.C. The U.S. delegation included representatives from OSD, Joint Staff, U.S. Southern Command, U.S. Special Operations Command, New York National Guard, U.S. Embassy Brasilia, and the Institute for Security Governance. The dialogue focused on global and hemispheric security issues, the thematic agenda for the October 2024 Conference of Defense Ministers of the Americas, and bilateral cooperation in emerging defense areas including cyber, space, and special operations. The delegations furthermore prioritized expanding synchronization of U.S. and Brazil defense industrial bases - as well as the concluding negotiation of the U.S.-Brazil Reciprocal Defense Procurement Agreement - a priority for both countries. They reaffirmed the importance of adhering to the highest standards of democratic values, the rule of law, and human rights in all aspects of the bilateral defense relationship. The U.S.-Brazilian Strategic Defense Talks provides a strategic framework to guide the bilateral defense relationship and security cooperation. The forum is a mechanism to discuss strategic-level defense issues and to guide future cooperation activities in the areas of defense and security. https://www.defense.gov/News/Releases/Release/Article/3880624/ NEWS LETTER Join the GlobalSecurity.org mailing list Enter Your Email Address"
https://www.livemint.com/market/ipo/unimech-aerospace-and-manufacturing-limited-files-draft-papers-for-500-crore-ipo-11724174713909.html,https://www.livemint.com/market/ipo/unimech-aerospace-and-manufacturing-limited-files-draft-papers-for-500-crore-ipo/amp-11724174713909.html,Unimech Aerospace and Manufacturing Limited files draft papers for ₹500 crore IPO,20240820T193000Z,https://www.livemint.com/lm-img/img/2024/08/20/600x338/IPO_1724175205264_1724175205442.jpg,livemint.com,English,India,ITA,Aerospace & Defense,aerospace,"View Market Dashboard Unimech Aerospace and Manufacturing Limited files draft papers for ₹500 crore IPO Unimech Aerospace and Manufacturing IPO, priced at ₹ 5 per equity share, consists of a fresh issue of up to ₹ 250 crore and an offer for sale of up to ₹ 250 crore by Promoter and Promoter Group Selling Shareholders. Vaamanaa Sethi Published 20 Aug 2024, 11:38 PM IST Unimech Aerospace and Manufacturing Limited files draft papers for ₹500 crore IPO ( iStock ) Bengaluru-based Unimech Aerospace and Manufacturing Limited, a global leader in high-precision engineering solutions for aerospace, defense, energy, and semiconductor industries, has submitted its draft red herring prospectus (DRHP) to the Securities and Exchange Board of India (SEBI) with the aim of raising ₹ 500 crore through an initial public offering (IPO). Unimech Aerospace and Manufacturing IPO, priced at ₹ 5 per equity share, consists of a fresh issue of up to ₹ 250 crore and an offer for sale of up to ₹ 250 crore by Promoter and Promoter Group Selling Shareholders. Additionally, the offer includes a reserved portion for eligible employee subscriptions. Also Read | Manjushree Technopack files DRPH to raise nearly ₹3,000 crore via IPO The offer for sale includes the following equity share sales: up to ₹ 45 crore by Ramakrishna Kamojhala, up to ₹ 45 crore by Mani P, up to ₹ 45 crore by Rajanikanth Balaraman, up to ₹ 30 crore by Preetham S V, and up to ₹ 85 crore by Rasmi Anil Kumar. About the company The proceeds from the new issue will be allocated as follows: ₹ 32.5 crore for capital expenditure on machinery and equipment to support the Company's expansion; ₹ 25.2 crore for working capital needs; ₹ 43.9 crore for capital expenditure on machinery and equipment; ₹ 44.7 crore for working capital requirements; ₹ 40 crore for the repayment or prepayment of certain borrowings, and general corporate purposes. Unimech Aerospace has recently secured ₹ 250 crore from investors such as Steadview Capital Mauritius Ltd, ValueQuest, and Evolvence through private placement financing. The offer is being conducted via a book-building process, with a maximum of 50% of the net offer allocated to qualified institutional buyers on a proportionate basis. At least 15% of the net offer will be available for non-institutional bidders, and no less than 35% will be allocated to retail individual investors. Also Read | Ideal Technoplast Industries IPO to open tomorrow; check GMP, price band, more. Founded in 2016, Unimech Aerospace and Manufacturing Limited specializes in ""build to print"" and ""build to specifications"" services, which include machining, fabrication, assembly, testing, and the development of new products based on client specifications. Unimech Aerospace and Manufacturing Ltd is a prominent manufacturer of complex tooling, mechanical assemblies, electro-mechanical turnkey systems, and precision components. These products are widely used in aeroengine and airframe tooling for production, MRO (Maintenance, Repair, and Overhaul), and line maintenance activities, as detailed in an F&S Report included in the DRHP . Anand Rathi Advisors Limited, and Equirus Capital Private Limited are the book-running lead managers to the issue and KFin Technologies Limited is the registrar to the offer. IPO Get Latest real-time updates Catch all the Business News , Market News , Breaking News Events and Latest News Updates on Live Mint. Download The Mint News App to get Daily Market Updates. Business News Markets IPO Unimech Aerospace and Manufacturing Limited files draft papers for ₹500 crore IPO HDFC Bank Share Price Reliance Industries Share Price TCS Share Price Infosys Share Price HUL Share Price More Story Url has been added to your clipboard Wait for it… Log in to our website to save your bookmarks. It'll just take a moment. Yes, Continue"
https://tulsaworld.com/news/local/education/aerospace-grants-to-benefit-tulsa-area-schools-organizations/article_ba834e32-58e8-11ef-a2d1-1b1dabf69e84.html,,"Aerospace grants benefit Tulsa - area schools , organizations",20240814T023000Z,https://bloximages.newyork1.vip.townnews.com/tulsaworld.com/content/tncms/assets/v3/editorial/b/a8/ba834e32-58e8-11ef-a2d1-1b1dabf69e84/66bbf8b494ba1.preview.jpg?crop=264%2C264%2C66%2C0,tulsaworld.com,English,United States,ITA,Aerospace & Defense,aerospace,"Steve Metzer Tulsa World Capitol Bureau Staff Writer Author email Follow Steve Metzer Facebook Twitter Bluesky WhatsApp SMS Email Print Copy article link Save OKLAHOMA CITY — The Tulsa Regional STEM Alliance and its Space Week program have been propelled forward a bit by grant funding awarded recently by the Oklahoma Department of Aerospace and Aeronautics. kAm$6G6C2= %F=D2 2?5 %F=D2\2C62 D49@@=D 2?5 @E96C 6?E:E:6D :?G@=G65 :? 26C@DA246 2?5 2G:2E:@? 65F42E:@? H6C6 2>@?8 5@K6?D @7 8C2?E C64:A:6?ED 24C@DD E96 DE2E6]k^Am kAm%96 s6A2CE>6?E @7 p6C@DA246 2?5 p6C@?2FE:4D[ H9:49 92D E2<6? E96 =625 :? 2? :?:E:2E:G6 E@ 56G6=@A 2 DEC@?8 ?6IE 86?6C2E:@? @7 A:=@ED[ 2:C4C27E >6492?:4D 2?5 @E96C 26C@DA246 :?5FDECJ AC@76DD:@?2=D[ 2??@F?465 7F?5:?8 @7 ?62C=J Sa >:==:@? E@ AC@>@E6 AC@8C2>D 56G6=@A65 2?5 DFAA@CE65 3J D49@@=D 2?5 @C82?:K2E:@?D C2?8:?8 7C@> %F=D2 r@>>F?:EJ r@==686 E@ E96 %F=D2 p:C U2>Aj $A246 |FD6F>]k^Am People are also reading… Tulsa Airport announces 4 new direct flights, with big projects progressing OSU AD Chad Weiberg nears historic football coach hire after Mike Gundy's termination After 40 seasons, a completely different life for Mike Gundy Cowboys' Marshawn Kneeland found dead of apparent suicide at 24 after evading officers, police say Analysis: OSU football fans likely have passed through the five stages of grief Sand Springs celebrates first district title since 1997 in Highway 97 rivalry | Four takeaways Cop raped female inmate, then handed her a stack of napkins. Is it a bigger pattern? 25-foot law enforcement buffer: What Oklahomans need to know about new law POLL CLOSED: Vote for the Bill Knight Automotive player of the week for Week 10 City launches new rehousing initiative for homeless, shows off early success $2 million pledged for 14-mile Gilcrease Museum trail system Oklahoma Watch: Stillwater teen's sex assault case leaves victims' families outraged Bill Haisten: The mayor’s son makes a big difference at Bishop Kelley DUI changes among five new laws taking effect Nov. 1 in Oklahoma City councilors question timing, process behind Nichols' proposed sales tax increase kAms6A2CE>6?E @77:4:2=D D2:5 :? 2 ?6HD C6=62D6 E92E 2 C64@C5 ?F>36C @7 8C2?E 2AA=:42E:@?D H2D C646:G65 E9:D J62C E@ DFAA@CE AC@8C2>>:?8[ :?4=F5:?8 2E “2G:2E:@? 9:89 D49@@=D[” :?4=F5:?8 :? q:I3J 2?5 qC@<6? pCC@H]k^Am kAm~<=29@>2 s:C64E@C @7 p6C@?2FE:4D vC2JD@? pC5:6D ?@E65 E92E >@C6 E92? g_ D49@@=D 92G6 6>3C2465 E96 p:C4C27E ~H?6CD 2?5 !:=@ED pDD@4:2E:@?’D “*@F r2? u=J” 4FCC:4F=F>]k^Am kAm“~<=29@>2 92D ?6G6C 366? 36EE6C A@D:E:@?65 E@ EFC? E@52J’D DEF56?ED :?E@ E@>@CC@H’D 26C@DA246 H@C<7@C46[” 96 D2:5]k^Am kAmvC2?E 7F?5:?8 H2D 2H2C565 E@ 6?4@FC286 6IEC24FCC:4F=2C $%t| 24E:G:E:6D DF49 2D E9@D6 @776C65 3J E96 %F=D2 #68:@?2= $%t| p==:2?46] x? C646?E J62CD[ E96 2==:2?46 92D DFAA@CE65 2? F?56CH2E6C C@3@E:4D 4@?E6DE[ D@=2C 64=:AD6 G:6H:?8 2?5 2 5C@?6 6G6?E[ 2>@?8 @E96C 24E:G:E:6D] xE H2D 2H2C565 2 Sf[aa_ 8C2?E E@ 96=A H:E9 :ED $A246 (66< AC@8C2>] p55:E:@?2==J[ :E C646:G65 S`[`d_ E@ 96=A H:E9 :ED $%t| $9@AA6 AC@8C2> E@ 36?67:E =@42= E62496CD]k^Am kAm~E96C %F=D2\2C62 7F?5:?8 C64:A:6?ED :?4=F56ik^Am kF=mk=:m%F=D2 p:C U2>Aj $A246 |FD6F>i Sd[___jk^=:mk=:m%F=D2 r@>>F?:EJ (@C<p5G2?46^|25:D@? $EC2E68:6D vC@FAi S`_[___jk^=:mk=:m%F=D2 r@>>F?:EJ r@==686i Sa[d__jk^=:mk=:mr=2C6>@C6 }y#~%ri Sa[ehhjk^=:mk=:m%F=D2 t2DE r6?EC2= w:89 $49@@=i Sd[b__jk^=:mk=:mq:I3J !F3=:4 $49@@=Di Sf[fd_jk^=:mk=:mqC@<6? pCC@H '2?8F2C5 p4256>Ji Sf[d__jk^=:mk=:mr@==:?DG:==6 !F3=:4 $49@@=Di Sf[___jk^=:mk=:mvC@G6 w:89 $49@@=i Sg[___jk^=:mk=:my6?<D uC6D9>2? p4256>Ji Sb[ba_jk^=:mk=:m|:2>: !F3=:4 $49@@=Di Sh[___jk^=:mk=:m#6;@:46 r9C:DE:2? $49@@= W~H2DD@Xi Sd[d__jk^=:mk=:m$EC@F5 !F3=:4 $49@@=Di Sd[___jk^=:mk=:m%29=6BF29 w:89 $49@@=i Sf[`__jk^=:mk=:mqC:DE@H !F3=:4 $49@@=Di Se[_d_jk^=:mk=:m%C: r@F?EJ %649?@=@8J r6?E6C Wq2CE=6DG:==6Xi S`c[b__]k^=:mk^F=m kAm“%92?<D E@ E96 G:D:@? 2?5 DFAA@CE @7 E96 ~<=29@>2 {68:D=2EFC6 2?5 @FC DE2E6’D =6256CD9:A[ H6 2C6 H:E?6DD:?8 2? 6I4:E:?8 A6C:@5 @7 8C@HE9 2?5 :??@G2E:@? :? 26C@DA246 2?5 5676?D6[” pC5:6D D2:5] “~FC 65F42E@CD 2C6 E96 4@C?6CDE@?6 @7 E9:D EC2?D7@C>2E:@?[ 8F:5:?8 2?5 :?DA:C:?8 E96 ?6IE 86?6C2E:@? @7 26C@DA246 AC@76DD:@?2=D]k^Am kAm“(:E9 2 C@3FDE ?6EH@C< @7 D49@@=D C625J E@ E2<6 7=:89E 2?5 E96 F?H2G6C:?8 DFAA@CE 7C@> :?5FDECJ A2CE?6CD[ ~<=29@>2 :D H6==\A@D:E:@?65 E@ 4@?E:?F6 =625:?8 E96 ?2E:@? :? 26C@DA246 65F42E:@? 2?5 H@C<7@C46 56G6=@A>6?E]”k^Am kAm%96 4@>>6C4:2= 2?5 5676?D6\C6=2E65 26C@DA246 :?5FDEC:6D 4@?EC:3FE6 2? 6DE:>2E65 Scc 3:==:@? 2??F2==J E@ E96 ~<=29@>2 64@?@>J]k^Am k9C ^m k9bmkDA2? 4=2DDlQAC:?E0EC:>Qm%96 %F=D2 (@C=5 :D H96C6 J@FC DE@CJ =:G6Dk^DA2?mk^9bm The Tulsa World newsroom is committed to covering this community with curiosity, tenacity and depth. Our passion for telling the story of Tulsa remains unwavering. Because your story is our story. Thank you to our subscribers who support local journalism. Join them with limited-time offers at tulsaworld.com/story . steve.metzer@tulsaworld.com 0 Comments Want to see more like this? Get our local education coverage delivered directly to your inbox. Sign up! * I understand and agree that registration on or use of this site constitutes agreement to its user agreement and privacy policy . Steve Metzer Tulsa World Capitol Bureau Staff Writer Author email Follow Steve Metzer Related to this story Most Popular In wake of Ryan Walters, no paper trail for PragerU 'partnership' exists Officials at the Oklahoma State Department of Education say they have not found any written documentation detailing the terms of the agency’s … Oklahoma Legislature gearing up for ""Literacy Session"" in 2026, in support of new state superintendent #oklaed CAP, tribal Head Starts remain open despite federal government shutdown Despite the shutdown, representatives from thew Cherokee Nation, Muscogee Nation and Community Action Project Tulsa each said their Head Start… TPS approves CFO agreement with OSDE Tulsa Public Schools’ board of education approved a trio of items tied to Chief Financial Officer Kristin Stephens’ role with the Oklahoma Sta… Ryan Walters' controversial social studies standards could be overhauled under successor New state superintendent signals uncertain future for Walters' mandate for teachings about Bible, American ""exceptionalism"" and debunked 2020 … Watch Now: Related Video Trump Floats 50-Year Mortgage to Boost Affordability Joe Castiglione, Joe Harroz react to OU regents' approval of west side football stadium renovations Joe Castiglione, Joe Harroz react to OU regents' approval of west side football stadium renovations US Senate Passes Bill to End Government Shutdown, Sends to House US Senate Passes Bill to End Government Shutdown, Sends to House Honoring those who have served on Veterans Day Honoring those who have served on Veterans Day"
https://www.marketscreener.com/quote/stock/HOWMET-AEROSPACE-INC-104922916/news/Howmet-Aerospace-Receives-Two-Notch-Rating-Upgrade-from-Moody-s-and-Outlook-Upgrade-from-Fitch-47573114/,,Howmet Aerospace Receives Two - Notch Rating Upgrade from Moody and Outlook Upgrade from Fitch,20240807T001500Z,https://www.marketscreener.com/images/twitter_MS_fdnoir.png,marketscreener.com,English,,ITA,Aerospace & Defense,aerospace,"Howmet Aerospace Receives Two-Notch Rating Upgrade from Moody’s and Outlook Upgrade from Fitch Key Announcements On August 6, 2024, Moody’s Ratings (“Moody’s”) upgraded Howmet Aerospace’s senior unsecured ratings from Baa3 to Baa1. On August 6, 2024, Fitch Ratings (“Fitch”) revised its Rating Outlook on Howmet Aerospace from Stable to Positive. Published on 08/06/2024 at 07:46 pm EDT - Modified on 08/06/2024 at 07:47 pm EDT Business Wire Share Howmet Aerospace Inc. -0.40% Howmet Aerospace (NYSE:HWM) today reported the following actions taken by rating agencies Moody’s and Fitch. On August 6, 2024, Moody’s upgraded Howmet Aerospace’s senior unsecured ratings from Baa3 to Baa1, the commercial paper ratings from P-3 to P-2, and the preferred stock ratings from Ba2 to Baa3. The senior unsecured rating change is a two-notch upgrade from the prior rating. The rating outlook was revised from positive to stable. On August 6, 2024, Fitch affirmed Howmet Aerospace’s senior unsecured debt ratings at BBB, the short-term and commercial paper ratings at F2, and the preferred stock ratings at BB+. The rating outlook was revised from stable to positive. About Howmet Aerospace Howmet Aerospace Inc., headquartered in Pittsburgh, Pennsylvania, is a leading global provider of advanced engineered solutions for the aerospace and transportation industries. The Company’s primary businesses focus on jet engine components, aerospace fastening systems, and airframe structural components necessary for mission-critical performance and efficiency in aerospace and defense applications, as well as forged aluminum wheels for commercial transportation. With approximately 1,150 granted and pending patents, the Company’s differentiated technologies enable lighter, more fuel-efficient aircraft and commercial trucks to operate with a lower carbon footprint. For more information, visit www.howmet.com . Dissemination of Company Information Howmet Aerospace intends to make future announcements regarding Company developments and financial performance through its website at www.howmet.com . View source version on businesswire.com: https://www.businesswire.com/news/home/20240806523776/en/ © Business Wire - 2024 Share"
