url,url_mobile,title,seendate,socialimage,domain,language,sourcecountry,ticker,industry,search_keyword,article_text
https://article.wn.com/view/2024/03/31/Israeli_tech_entrepreneurs_die_in_California_plane_crash_o/,,Israeli tech entrepreneurs die in California plane crash,20240331T190000Z,,article.wn.com,English,United States,XLK,Technology,tech industry,"system Top Stories Live World N.America & Canada Central America South America Africa Asia Oceania Europe Middle East Journalism Review Julian Assange Assange Videos Chris Hedges UK Column Rebel News John Pilger War on Terror - Articles War on Terror - Videos Business FIAT Currencies Crypto Currencies Markets Commodities Stocks Rates & Bonds Futures Blockchain Science & Technology AI Cybercrime Fuel Cells & Batteries Gaming Medical Instruments Mobiles & Wifi Robotics & Drones Space Sport Basketball American Football Tennis Golf Football Environment Renewable Energy Plastic Microplastic Climate change Waste Disposal Recycling Ocean Acidification Ice Loss Biodiversity Deforestation Ozone Layer Depletion Global Warming Arts & Culture Music Comedy Film Fashion Education Books Health GM Food Dangers GMO Corporate News Animal Farming Diet Yoga Mental Wellbeing Coronaviruses More Open Minds Weather Local Israeli tech entrepreneurs die in California plane crash Posted 2024-03-31, The Guardian Headlines NTSB and FAA to look into crash that killed investors Naomi Petrushka and Liron Petrushka, an ex-professional soccer player A couple from Israel who made a name for themselves as well as a fortune in the tech industry were killed after their plane crashed in a California town near the Nevada border ... read full story Ask about this article Answer for your question of the article will be displayed here ... Interpret EXPLORE WN.com Advanced Search Education Cities.com Dubai.com TravelAgents.com Weather World Photos Cheese.com Broadcasts.com Metas.com Students.com Emissions.com Population.com Domaines.com Wages.com © 2025 All Rights Reserved, World News Inc.| About WN | Sitemap | Privacy Policy | Contact | Jobs | Feedback | Newsletter"
https://en.globes.co.il/en/article-37b-in-israel-acquisition-deals-since-start-of-war-1001475169,,$3 . 7b in Israel acquisition deals since start of war,20240331T163000Z,https://res.cloudinary.com/globes/image/upload/t_800X392/v1705313809/COT_Pic/800_lfhtnw.jpg,en.globes.co.il,English,Israel,XLK,Technology,tech sector,"Israel's tech sector remains strong since the start of the war, according to new data from Startup Nation Central. In the nearly six months since the war began on October 7, Israeli startups have raised $3.1 billion in 220 private financing rounds. The biggest financing round completed since the start of the war was by fintech company Next Insurance, which received investments of over $250 million from each of two foreign investment funds. RELATED ARTICLES IVC-LeumiTech: Israeli startups raised $1.6b in Q1 The data also show that the overall amount of mergers and acquisitions in Israel's tech sector since the start of the war totaled $3.7 billion. Among the companies acquired for large amounts were Talon Security, acquired by Palo Alto Networks for $625 million, Dig Security, also acquired by Palo Alto for $350 million, Avalor acquired by Zscaler for $350 million and Gem Security acquired by Israeli company Wiz for $350 million. Two other cybersecurity companies - Flow Security and Spera Security, were acquired for $200 million and $130 million, respectively. In the healthcare sector, there were also major acquisitions with CartiHeal, which manufactures coral implants to support damaged human cartilage, acquired for $330 million. ""After the war, I anticipate a startup baby-boom of tech companies"" The report found that since October 7, 20 new Israeli venture capital funds have been founded that have raised an overall $2 billion. Eleven of the funds were founded to provide a response to the urgent needs of startups experiencing financing difficulties because of the war. Among these funds were Iron Nation, the resilience fund set up by OurCrowd, Trendlines - Startup Shield SPV, a fund supported by Google Support Fund, as well as other funds. These figures come alongside a significant fall in manpower in the industry since October 7, with about 15% of employees drafted into the army reserves and short term financing shortfalls caused by the war, mainly hitting early stage startups. The data for the report was gathered by Finder Spotlight Research. SNC CEO Avi Hasson said, ""With attractive valuations and significant growth potential, the Israeli tech ecosystem is showing characteristic resilience. I anticipate seeing a new wave of innovation - a ‘startup baby boom’ of tech companies - which will create even more dynamic opportunities for our sector after this war."" Published by Globes, Israel business news - en.globes.co.il - on March 31, 2024. © Copyright of Globes Publisher Itonut (1983) Ltd., 2024."
http://www.koreatimes.co.kr/www/world/2024/03/501_371719.html,https://m.koreatimes.co.kr/pages/article.amp.asp?newsIdx=371719,"US updates export curbs on AI chips , tools to China",20240330T140000Z,https://img.koreatimes.co.kr/upload/thumbnailV2/3598b0a550154d6a97cf2b207976a008.png,koreatimes.co.kr,English,South Korea,XLK,Technology,tech sector,"World US updates export curbs on AI chips, tools to China Listen Listen Text Size Print gettyimagesbank Published Mar 30, 2024 8:24 pm KST Updated Mar 30, 2024 8:24 pm KST The Biden administration revised rules aimed at making it harder for China to access U.S. artificial intelligence (AI) chips and chipmaking tools, Friday, part of an effort to hobble Beijing's chipmaking industry over national security concerns. The rules, released in October, seek to halt shipments to China of more advanced AI chips designed by Nvidia and others as Washington cracks down on Beijing over concerns its advancing tech sector could help boost China's military. The new rules, which run 166 pages in length, go into effect next Thursday. They clarify, for example, that restrictions on chip shipments to China also apply to laptops containing those chips. The Commerce Department, which oversees export controls, has said it plans to continue updating its restrictions on technology shipments to China as it seeks to bolster and fine-tune the measures. (Reuters) Go to Top"
https://qz.com/tech-stocks-rally-citi-analysts-downgrade-market-1851374353,,"Tech stocks rally is running out of room , Citi says",20240329T161500Z,"https://i.kinja-img.com/image/upload/c_fill,h_675,pg_1,q_80,w_1200/080f2a41b16cb7b87092257fe24fb373.jpg",qz.com,English,United States,XLK,Technology,tech sector,"Markets The tech stocks rally has reached 'euphoria' and is running out of room, Citi says Analysts says the tech sector’s part of the broader market rally could soon slow By Vinamrata Chaturvedi Share to Twitter Share to Facebook Share to Reddit Share to Email Share to Link Tech giants and AI helped power stocks to record highs in the first quarter of 2024. But with the second quarter about to begin, one group of analysts says the tech sector’s part of the broader market rally could soon slow. Suggested Reading Warren Buffett's Thanksgiving letter set the table for Berkshire Hathaway's next chapter The Mega Millions jackpot nears $1 billion. Here are the 5 biggest wins ever An economic data blackout is about to lift Citi analysts have downgraded the tech sector from overweight to market-weight, Bloomberg reports. Citi’s sentiment gauge, The Levkovich Index, has hit the “euphoria” level, suggesting that returns later in the year will be lower. Related Content 50-year mortgages would backfire on buyers An economic data blackout is about to lift Citigroup equity strategists believe the U.S. stock market has much more to offer than tech stocks. While they downgraded the tech sector to market-weight, Bloomberg reports, they indicated modest overweight in parts of the sector, including Microsoft, which still maintains its overweight status. Despite the growth of AI , the Citi analysts kept semiconductor stocks at market-weight, including companies such as AI chipmaking giant Nvidia and Micron Technology . On the other hand, they downgraded the hardware sector to underweight, which includes tech giants such as Apple and Dell. More markets and crypto news The S&P 500 had its best start since 2019 as AI and the Fed powered stocks to new highs Tesla’s horrible, no good, very bad, ‘nightmare’ first quarter Disney and Nelson Peltz keep fighting but the stock just keeps rising Bitcoin is about to see a big ‘halving’ event. Here’s what that means, when it is, and why it matters Forget Apple and Tesla: Maybe the ‘Magnificent Seven’ tech stocks should be the ‘Fabulous Five’ The AI and crypto worlds have merged to become ‘Artificial Superintelligence.’ Here’s what to know Reddit stock dropped 25% in 2 days because the short-sellers have arrived Will Elon Musk accept Dogecoin on X? What to know about the cryptocurrency The top 5 spot Bitcoin ETFs 📬 Sign up for the Daily Brief Our free, fast and fun briefing on the global economy, delivered every weekday morning. Sign me up"
https://www.princeton.edu/events/2024/responsible-ethics-pitch-competition,,Responsible Ethics Pitch Competition,20240329T013000Z,,princeton.edu,English,United States,XLK,Technology,tech industry,"Event details Mar 29 Responsible Ethics Pitch Competition Conference , Innovation & Entrepreneurship , Environment , Service & Civic Engagement , Social , Humanities , Computer Science , Public Policy Share on Facebook Share on Twitter Share on LinkedIn Email Print Responsible ethics pitch competition for students to design solutions to ethical concerns harming the tech industry University programs and activities are open to all eligible participants without regard to identity or other protected characteristics. Sponsorship of an event does not constitute institutional endorsement of external speakers or views presented. View physical accessibility information for campus buildings and find accessible routes using the Princeton Campus Map app. Date March 29, 2024 Time 10:00 a.m. Location Friend Center, 101 Audience Open to the Public , Faculty & Academic Professionals , Staff , Students , Alumni University Sponsors Impact Capital"
https://www.computerweekly.com/podcast/Cloud-Native-Computing-A-Computer-Weekly-Downtime-Upload-podcast,,Cloud Native Computing : A Computer Weekly Downtime Upload podcast,20240325T164500Z,,computerweekly.com,English,United Kingdom,XLK,Technology,tech sector,"Getty Images/iStockphoto Listen to this podcast We speak to Priyanka Sharma, the executive director of the Cloud Native Computing Forum about having blind faith in tech innovation Podcast During the recent KubeCon/CloudNativeCon 2024 event in Paris, Computer Weekly met with Priyanka Sharma, executive director of the Cloud Native Computing Forum (CNCF), to record this podcast, looking into trends driving Kubernetes, inclusivity and the perceived gap between the cloud native community and senior IT management. The tech industry is constantly pushing new technologies. Artificial Intelligence (AI) is the latest tech driving conversations across the tech sector. It is something those involved in advancing Kubernetes and cloud native architectures regard as an important technolology to support. But like many tech innovations, there is a lot of industry hype associated wuth AI. Quoting Alan Greenspan, former chief of the Federal Reserve Board in the US, Sharma used her keynote to discuss “irrational exuberance” in technology innovation. Greenspan’s quote refers to the risk that some US stock prices are overvalued. In the tech sector and across society, Sharma points out that people get very excited about new technology innovation. She says they invest in resources and spend time looking into concepts that are not 100% fully thought through. Some of these may not yield the results needed to give a return on this investment. “Identifying that something is irrationally exuberant is,” says Sharma: “When there's a bit of cognitive dissonance.” Sharma is a self-taught software developer and she admits she has had ups and downs in her journey in software development. Her journey began when she was setting up her own startup. “We had to build our website. Someone had to get it going and that's how I learned.” Now, full time at CNCF (Cloud Native Computing Foundation), her main opportunities to drill down into software development happens in preparation for the twice-yearly KubeCon/CloudNativeCon events. Kubernetes is being positioned as the technology to make AI workable. Container orchestration is being applied to manage graphics processing units (GPUs) for running machine learning and inference workloads. During her keynote presentation, Sharma gave a little demo showcasing the ease with which she could depoy a Large Language Model (LLM) application on her laptop using Kubernetes. She says: “Over the last few years, I have actually really enjoy doing my keynotes. That's where I've made a conscious decision to immerse myself in a certain technology, learn as much as I can and develop a demo with the help of my team and then deliver it. That is often the way I get to stay engaged [in software development] while also running an organisation that has as large of a footprint as CNCF.” In the video below, Enterprise Strategy Group analysts discusss the highlights of KubeCon 2024 in Paris."
https://www.ots.at/pressemappe/PR50272,,Sopra Steria SE,20240325T121500Z,https://static.ots.at/css/images/distributed-by-apa-ots_250px.png,ots.at,English,Austria,XLK,Technology,tech sector,"menu search info Über APA-OTS photo_camera Aktuelle Bilder play_arrow Aktuelle Videos event Aktuelle Termine search Suche Alle Aussendungen Politik Wirtschaft Finanzen Chronik Kultur Medien Karriere Tourismus Bundesländer Sopra Steria SE search Suche in Pressroom https://www.soprasteria.de/de Aussendungen Kontaktpersonen Sopra Steria SE Sopra Steria stärkt seine datenzentrierte Cybersicherheitslösung mit hybrider Post-Quantum-Kryptografie-Technologie Paris (OTS/PRNewswire) - 10.09.2025, 15:11:03 / OTS0161 Sopra Steria SE Sopra Steria stärkt seine datenzentrierte Cybersicherheitslösung mit hybrider Post-Quantum-Kryptografie-Technologie Paris (OTS) - Paris (ots/PRNewswire) 09.09.2025, 16:03:08 / OTS0162 Sopra Steria SE Laut einem Bericht von Sopra Steria erachten sieben von zehn europäischen Unternehmen die Zusammenarbeit mit Start-ups als „entscheidend"" Paris (OTS) - Paris (ots/PRNewswire) 27.05.2025, 12:02:32 / OTS0092 Sopra Steria SE Sopra Steria enables Banks to enter the Crypto-Asset market with a complete and tailored-made offer Paris (OTE) - Paris (ots/PRNewswire) - 23.04.2025, 15:07:17 / OTE0003 Sopra Steria SE Sopra Steria stellt finanzielles Wohlergehen als Hauptunterscheidungsmerkmal im Bankwesen vor Paris (OTS) - Paris (ots/PRNewswire) - 08.04.2025, 22:13:32 / OTS0114 > https://www.soprasteria.de/de So erreichen Sie uns APA-Comm GmbH Laimgrubengasse 10 1060 Wien, Österreich PR-Desk Support Tel. +43 1 36060-5310 APA-Salesdesk Tel. +43 1 36060-1234 comm@apa.at Services PR-Desk APA-OTS-Video APA-Fotoservice Cookie-Präferenzen OTS-App Channels Politik Wirtschaft Finanzen Chronik Kultur Medien Karriere Tourismus Bleiben Sie informiert OTS-Mailabo APA-Blog Newsletter Abonnieren © 1997 - 2025 APA-Comm GmbH und der jeweilige Aussender. Alle Rechte vorbehalten. Hilfe / Datenschutz / Impressum / Offenlegung / AGB / Cookie-Präferenzen / Copyright"
https://www.bloomberg.com/news/articles/2024-03-25/china-s-tech-sector-may-rival-property-as-growth-driver-be-says,,"China Tech Sector May Rival Property as Growth Driver , BE Says",20240325T113000Z,https://assets.bwbx.io/images/users/iqjWHBFdfxIU/iLZBOfgiB3M0/v0/1200x715.png,bloomberg.com,English,United States,XLK,Technology,tech sector,"Technology Facebook X LinkedIn Email Link Gift Facebook X LinkedIn Email Link Gift Gift this article Contact us: Provide news feedback or report an error Confidential tip? Send a tip to our reporters Site feedback: Take our Survey New Window Facebook X LinkedIn Email Link Gift By Tom Hancock March 25, 2024 at 10:54 AM UTC Bookmark Save Lock This article is for subscribers only . China’s high-tech sector is driving an increasing amount of demand for goods and services in the world’s second-biggest economy, and its contribution could rival real estate by 2026, according to Bloomberg Economics. “The high tech sector has potential to become a much more significant source of growth,” economists Chang Shu and Eric Zhu wrote in a report Bloomberg Terminal . It’s estimated to drive demand worth nearly 19% of GDP by 2026, up from 14.3% last year, and almost on par with the property sector now."
http://www.gdnonline.com/Details/1307207/Ukrainian-women%E2%80%99s-startups-drive-tech-sector-resilience,,International Business : Ukrainian women startups drive tech sector resilience,20240323T080000Z,https://www.gdnonline.com/gdnimages/20240323%5C20240323_083931_0.jpg,gdnonline.com,English,United States,XLK,Technology,tech sector,"War in Ukraine has pushed women into more leadership roles in its growing tech sector, where they are gaining experience and contacts abroad that could help rebuild the economy when the conflict ends, some entrepreneurs, companies and investors say. With most men unable to leave Ukraine, women tech entrepreneurs like Anna Lissova, 30, who runs mental health startup Pleso Therapy, have taken charge of raising funds, finding new clients abroad and embracing other key roles. Before the war she focused on recruiting therapists in Ukraine. Now she travels abroad to pitch the company at conferences and has led product launches in Poland and Romania. “I had to suddenly change my role and take over the public representation of the company. The war led to women taking more senior positions and power in startups,” she said. Martial law prohibits most men of military age from leaving the country, creating a need and space for female tech entrepreneurs at home and abroad. They are able to build on a stronger representation by women in leadership positions in Ukraine than in the European Union and globally. Some say they still face prejudice in the traditionally male-dominated tech industry however, or describe their struggles to run a business while adapting to life as a refugee and having to raise families alone with fathers still in Ukraine. Over the past decade, Ukraine has boasted one of eastern Europe’s fastest growing tech hubs with startups attracting funding and clients from a large domestic market. Proportion Women were underrepresented however, making up only around 30 per cent of managers in the professional, scientific and technical sector, whereas they occupied 40pc of leadership positions in Ukraine overall in 2017-2022, according to a study by the United Nations Development Programme. The study highlighted that the proportion of Ukrainian women leaders nonetheless outstripped a figure of 35pc for the European Union and 29pc globally. Separate figures by Eurostat show around 17pc of major tech jobs are held by women in the European Union. Reuters spoke to nearly a dozen venture capitalists, tech founders and industry officials to document the critical – and often new – roles women have played in driving a sector seen as key to Ukraine’s economic prospects when the war ends. “Women’s leadership within the tech sector has become more pronounced after the full-scale invasion,” said Pavlo Kartashov, director of the Ukrainian Startup Fund (USF), a government-backed body that seeds startups. This rings especially true for ambitious startups looking to grow abroad, as many that have stayed in Ukraine focus on military or war-related technology such as drones, he added. The tech sector has proved resilient. While Ukraine’s GDP plummeted nearly 30pc in 2022, tech sector revenue rose nearly 1pc to $7.97 billion and was forecast to increase to $8bn in 2023, according to state statistics compiled by the Lviv Tech Cluster. The industry also accounts for nearly 5pc of Ukraine’s GDP with the number of tech specialists inside and outside Ukraine rising to 307,000 in 2023 from 285,000 in 2022. These numbers include the Lisbon-based founder of digital currency payment platform GeekPay. Veronica Korzh, who founded the startup three months after leaving Ukraine in February 2022, has witnessed a leap in female founders, due in part to increased access to investors outside Ukraine and accelerator programs targetting women funded by the EU, international bodies and tech multinationals. For many tech workers, Poland is a first stop as it borders Ukraine and the countries have long business and cultural ties. Anastasiia Smyk, 27, an aeronautical engineer, launched her aviation operations management software company Input Soft outside Ukraine in Warsaw, where she tapped a burgeoning refugee tech community. Her product is now used in the US, Latin America and Southeast Asia. “When talking to male investors, there were questions like ‘Why were you appointed CEO of this company?’ or ‘Please share if you have any male business partners’” she said. But she fought against the prejudice. “My job was to find investments, recognition in the global market, and international clients who would become our early adopters, which was not easy for a no-name startup company from Ukraine,” Smyk said. Looking at the startups founded by Ukrainian refugees she predicts many will return to the country when the war ends and give a huge boost."
