url,url_mobile,title,seendate,socialimage,domain,language,sourcecountry,ticker,industry,search_keyword,article_text
https://www.indiatimes.com/worth/news/meet-rohan-murty-son-of-narayana-and-sudha-murty-who-carries-their-ideology-ahead-635628.html,https://www.indiatimes.com/amp/worth/news/meet-rohan-murty-son-of-narayana-and-sudha-murty-who-carries-their-ideology-ahead-635628.html,Meet Rohan Murty : Son Of Narayana And Sudha Murty Who Will Carry On Their Legacy,20240604T153000Z,https://im.indiatimes.in/content/2024/Jun/bccl4_665ef7b9ae8a7.jpg,indiatimes.com,English,India,XLK,Technology,tech industry,"Meet Rohan Murty: Son Of Infosys Co-Founder Narayana And Sudha Murty Who Will Carry On Their Legacy IT Worth Desk | Jun 04, 2024, 16:33 IST Inspired by the values and vision of his parents, Rohan Murty's journey from a prestigious education to founding his own company, Soroco, showcases his commitment to carrying forward the Murty legacy. Join us as we explore the life and achievements of Rohan Murty, a visionary in his own right. Rohan Murty, the son of renowned Infosys founder Narayana Murty and celebrated author and philanthropist Sudha Murty, is a name that resonates with innovation and legacy. While his father revolutionised the Indian tech industry with Infosys, Rohan Murty is carving his own path in the world of digital transformation. Inspired by the values and vision of his parents, Rohan Murty's journey from a prestigious education to founding his own company, Soroco, showcases his commitment to carrying forward the Murty legacy. Join us as we explore the life and achievements of Rohan Murty, a visionary in his own right. Rohan Murty's Professional Journey Rohan Murty’s journey in the tech industry is as impressive as his father's. Initially serving as Vice President at Infosys , Rohan Murty decided to branch out and create his own path. He founded Soroco , a digital transformation company that specializes in automation through AI. Currently, he is the CTO at Soroco. While Soroco keeps its revenue figures confidential, the NelsonHall Vendor Evaluation & Assessment Tool (NEAT) projected the company's revenue for 2022 to be $18 million (around Rs 150 crore), as reported in DNA. Rohan Murty's Educational Background ( Image credit : BCCL ) Rohan Murty’s academic background is equally noteworthy. He attended Bishop Cotton Boys' School in Bangalore and graduated from Cornell University. He then went on to earn a PhD in computer engineering from Harvard University. This solid educational foundation has greatly contributed to his professional success. Also Read: Not Money, Infosys Founder Narayana Murthy Says This Is The Most Important Factor For Employees Influences from the Murty Family Rohan Murty’s family has been a significant influence on his life. His mother, Sudha Murty , is a renowned author, philanthropist, and one of the first female engineers at Tata Motors . Her achievements and values have deeply impacted Rohan. Additionally, his maternal uncle, Shrinivas Kulkarni , a professor of astrophysics and planetary science at the California Institute of Technology, has also been a source of inspiration. Rohan’s older sister, Akshata Murty , is married to UK Prime Minister Rishi Sunak , adding to the illustrious family background. Rohan Murty's Family Life ( Image credit : BCCL ) Rohan Murty’s personal life is as intriguing as his professional one. He is married to Aparna Krishnan, and together they welcomed their son, Ekagrah Rohan Murty , on November 10, 2023, in Bengaluru. Ekagrah, whose name signifies unwavering focus and determination, is possibly the youngest millionaire in India, owning a 0.04 percent stake in Infosys worth Rs 240 crore, a gift from his grandfather Narayana Murthy. Also Read: Before Narayana Murthy’s ‘70-Hour’ Advice, It Was Elon Musk Who Rallied For 100-hour Work Week Carrying Forward the Murty Legacy Rohan Murty’s journey reflects the values and vision of his parents, Narayana Murty and Sudha Murty. Through his innovative work at Soroco and his dedication to technology and automation, Rohan Murty continues to uphold and advance the Murty legacy, carrying forward the ideology of his esteemed parents. Rohan Murty’s achievements and his dedication to his family’s values are a testament to the strong influence of Narayana Murty and Sudha Murty. As he forges his own path in the tech industry, Rohan Murty remains a significant figure, embodying the principles and legacy of his parents. GENERAL IT Worth Desk You may also like 0 Latest Stories Trending Now Why Prince Harry and Meghan Markle's photos vanished from Kris Jenner's 70th birthday party, and their secret agenda revealed By Garima Satija Fans thinks Austin McBroom looked 'pained' after ex-wife Catherine Paiz announced pregnancy one month after wedding to Igor Ten By Sneha Kumari Kylie Jenner and Timothée Chalamet aren’t over — here’s how she used her signature move to shut down split buzz By Priya Prakash TikTok and Instagram’s new purple profile picture trend started after an online protest? By Saloni Jha Why Adin Ross is moving over to Twitch for his 'major' streams? Promises of not 'running ads'; here's what we know By Sneha Kumari When does Grey’s Anatomy season 22 come back in 2026? Full recap, release schedule and everything fans must know By Priya Prakash Physical: Asia shocker: Türkiye’s disqualification gives Mongolia an epic win; fans say 'not for people with low IQ' By Simran Guleria"
https://www.globenewswire.com/news-release/2024/06/04/2892698/0/en/Regenx-Announces-Expiry-of-MCTO.html,,Regenx Announces Expiry of MCTO,20240604T051500Z,https://ml.globenewswire.com/Resource/Download/e981149e-905b-4f26-b393-c3ee0533ce4b,globenewswire.com,English,United States,XLK,Technology,tech sector,"EDMONTON, Alberta, June 03, 2024 (GLOBE NEWSWIRE) -- Regenx Tech Corp ., (the "" Corporation "" or "" Regenx "") (CSE: RGX) (OTCQB: RGXT) (FSE: YRS WKN: A2DSW3) announces that, further to its news releases dated April 12, May 1, May 13, May 24 and May 29, 2024, its principal regulator, the Alberta Securities Commission, has confirmed that the management cease trade order that was issued on May 1, 2024, will no longer be in effect as of June 3, 2024. About Regenx Regenx is positioned for growth in the Clean Tech sector through the development and commercialization of its environmentally friendly processing technologies for the recovery of precious metals. Initial focus is the extraction of platinum and palladium from diesel catalytic converters with its business partner Davis Recycling. For further information visit www.Regenx.Tech For further information contact: REGENX TECH CORP. Greg Pendura CEO 780 800-0726 investors@regenx.tech"
https://article.wn.com/view/2024/06/01/Event_expected_to_help_connect_Vietnamese_Japanese_businesse/,,"Event expected to help connect Vietnamese , Japanese businesses in Eco tech industry",20240601T053000Z,,article.wn.com,English,United States,XLK,Technology,tech industry,"system Top Stories Live World N.America & Canada Central America South America Africa Asia Oceania Europe Middle East Journalism Review Julian Assange Assange Videos Chris Hedges UK Column Rebel News John Pilger War on Terror - Articles War on Terror - Videos Business FIAT Currencies Crypto Currencies Markets Commodities Stocks Rates & Bonds Futures Blockchain Science & Technology AI Cybercrime Fuel Cells & Batteries Gaming Medical Instruments Mobiles & Wifi Robotics & Drones Space Sport Basketball American Football Tennis Golf Football Environment Renewable Energy Plastic Microplastic Climate change Waste Disposal Recycling Ocean Acidification Ice Loss Biodiversity Deforestation Ozone Layer Depletion Global Warming Arts & Culture Music Comedy Film Fashion Education Books Health GM Food Dangers GMO Corporate News Animal Farming Diet Yoga Mental Wellbeing Coronaviruses More Open Minds Weather Local Event expected to help connect Vietnamese, Japanese businesses in Eco tech industry Posted 2024-06-01, Vietnam News Headlines The event is expected to provide practical opportunities for Vietnamese businesses in the Eco tech industry to approach new market trends, innovative technical and technological achievements. HÀ NỘI — An online business matching event aiming to creating opportunities for Vietnamese businesses in the ... read full story Ask about this article Answer for your question of the article will be displayed here ... Interpret EXPLORE WN.com Advanced Search Education Cities.com Dubai.com TravelAgents.com Weather World Photos Cheese.com Broadcasts.com Metas.com Students.com Emissions.com Population.com Domaines.com Wages.com © 2025 All Rights Reserved, World News Inc.| About WN | Sitemap | Privacy Policy | Contact | Jobs | Feedback | Newsletter"
https://www.jpost.com/business-and-innovation/article-804503,https://m.jpost.com/business-and-innovation/article-804503,Next47 report provides data on the resilience of Israeli tech ecosystem,20240531T121500Z,"https://images.jpost.com/image/upload/f_auto,fl_lossy/c_fill,g_faces:center,h_407,w_690/601262",jpost.com,English,Israel,XLK,Technology,tech sector,"Next47’s report shows Israel’s tech sector resilience Global trends can often feel extra concentrated within Israel, especially for a sector typically seen as a constant bright spot in the country’s economy and culture. Moshe Zilberstein Partner at Next47 ( photo credit : Next47 )"
https://www.afr.com/markets/equity-markets/asx-to-rise-techs-slump-hits-wall-street-20240531-p5ji5m,,"ASX 200 LIVE : ASX to rise ; Wall Street retreats , Salesforce , Nvidia , Atlassian fall",20240530T220000Z,https://static.ffx.io/images/$zoom_0.482%2C$multiply_2%2C$ratio_1.777778%2C$width_1059%2C$x_0%2C$y_0/t_crop_custom/c_scale%2Cw_800%2Cq_88%2Cf_jpg/t_afr_live_no_age_social_wm/d2ed388b634a7e3bea76d91e40517c422c2e564d,afr.com,English,Australia,XLK,Technology,tech sector,"Markets Equity Markets Markets Live Print article Timothy Moore , Tom Richardson , Sarah Jones , Joshua Peach , Alex Gluyas and Cecile Lefort Updated May 31, 2024 – 4.34pm , first published at 7.24am Save Log in or Subscribe to save article Share Copy link Copied Email LinkedIn Twitter Facebook Copy link Copied Share via... Key Posts 4.34PM — May 31, 2024 Shares rebound on Friday; Banks, Woolworths climb 3.56PM — May 31, 2024 Westpac sues insurers over $1.3b AUSTRAC penalty 3.03PM — May 31, 2024 ‘Expensive’: Wilson analyst Shaun Weick questions Guzman y Gomez valuation 2.48PM — May 31, 2024 How Geoff Wilson assembled his investment dream team 2.29PM — May 31, 2024 Shares climb 0.5pc; Guzman y Gomez flags IPO 2.05PM — May 31, 2024 Fast food chain Guzman y Gomez flags $2.2b IPO Advertisement Go to latest Pinned post – 4.34PM – May 31, 2024 Shares rebound on Friday; Banks, Woolworths climb Tom Richardson Share post Copy link Copied Email LinkedIn Twitter Facebook Copy link Copied Share via... Australian shares snapped a three-day losing streak on Friday, sending the S & P/ASX 200 up 1 per cent, or 73.5 points, to 7701.7 points. For the week, the benchmark index finished down 0.3 per cent as investors sold equities after hotter-than-expected inflation data for April pushed back the timeline for when the Reserve Bank may start cutting interest rates. On Wall Street overnight the Nasdaq index retreated 1.1 per cent after enterprise software giant and Slack-owner Salesforce plummeted 19.7 per cent on its trading update. The yield on one-year Australian bonds added 4 basis points to 4.45 per cent over the session and has added 12 basis points since Wednesday. On Friday night AEST the US personal income, spending and price report is expected to influence the direction of sharemarkets next week as a key signpost for the future direction of US interest rates. Economists expect the personal consumption expenditures price index – the Federal Reserve’s preferred measure of inflation – will rise 0.2 per cent in April. Stocks in focus On the ASX every sector finished higher, except the interest rate sensitive property sector which lost 0.2 per cent. The best-performing sector on the day was consumer staples, boosted by a 2.8 per cent rise for Treasury Wine estates to $11.33. Bega Cheese surged 6.2 per cent to $4.46 and Woolworth rose 2 per cent to $31.60. The big four banks also finished higher with Commonwealth Bank rallying 1.3 per cent, to 119.54 and ANZ climbing 1.2 per cent to $28.25. Westpac and National Australia Bank rose less than 1 per cent. The best-performing stock on the benchmark index was Telix Pharmaceuticals. It jumped 15.3 per cent to $18.15 after broker Wilsons issued a positive note on the business and its latest clinical trial results. The biotech sensation has climbed around 1380 per cent in five years to a $5.4 billion valuation. Elsewhere, burritos merchant Guzman y Gomez flagged plans to hit the ASX boards in June on an enterprise valuation of 32.5 times forecast EBITDA of $59.9 million in financial 2025. 1 / 3 Next Page Oldest Back to top Fetching latest articles We met a professional shoplifter to understand this crime’s popularity Greg Bearup and Carrie LaFrenz Shaken, stirred and a little smoky: three cocktails to define summer This restaurant is stuck in the past. That’s what makes it great Why job hopping might now be the fastest route to a six-figure salary Hannah Tattersall Curtis Stone’s $4m flop forced him to rethink everything The secret weapon boards are deploying to survive AGM season Why this is the year to finally go to Africa Kendall Hill Is South America on your bucket list? Here are 5 reasons it should be These 5 secluded escapes are just a short flight away Goldman Sachs dealmaker lists $22m Brighton mansion with two pools Sarah Petty ‘I was sitting on a bench’: How a chance encounter led to a $5b empire Billionaire Shahin family takes stake in Perth payment fintech Bless"
https://globalnews.ca/news/10535264/sp-tsx-composite-may-30-2024/,https://globalnews.ca/news/10535264/sp-tsx-composite-may-30-2024/amp/,"S & P / TSX composite up more than 150 points , U . S . stock markets fall",20240530T220000Z,https://globalnews.ca/wp-content/uploads/2024/05/2024053011054-670aef7a7150d012a5bba9788a99917b347d607d0f52514a918a4bf341ae5d96_d10c64.jpg?quality=85&strip=all&crop=1,globalnews.ca,English,Canada,XLK,Technology,tech sector,"Canada’s main stock index differentiated itself from sliding U.S. markets Thursday, gaining more than 150 points on the back of better-than-expected quarterly results from Royal Bank and CIBC. The S&P/TSX composite index was up 173.73 points at 22,071.71, driven by gains in the financial sector, which climbed 1.89 per cent in the day’s trading. The big winners were Royal Bank — which closed up 5.19 per cent after announcing a dividend hike and share buyback plan in the wake of the successful close of its HSBC Canada acquisition – and CIBC, which gained 7.01 per cent after reporting a second-quarter profit of $1.75 billion, up from $1.69 billion in the same quarter last year. South of the border, it was a different story. In New York, the Dow Jones industrial average closed down 330.06 points at 38,111.48, while the S&P 500 index was down 31.47 points at 5,235.48. The Nasdaq composite closed down 183.50 points at 16,737.08. Story continues below advertisement The declines were largely the result of losses in the tech sector. U.S. software giant Salesforce saw its stock suffer its worst day in nearly 20 years, losing nearly a fifth of its value after reporting weaker revenue for the latest quarter than analysts expected. Get daily National news Get the day's top news, political, economic, and current affairs headlines, delivered to your inbox once a day. Sign up for daily National newsletter Sign Up By providing your email address, you have read and agree to Global News' Terms and Conditions and Privacy Policy . Nvidia also fell Thursday, sinking 3.8 per cent for its first drop since soaring more than 20 per cent following its earnings report last week. The tech-sector losses were significant enough to drag down the main U.S. indexes even though the majority of Wall Street stocks gained Thursday. More on Money More videos Health Canada recalls ‘laughing gas’ sold without authorization Trump wants to bring in 50-year mortgages. Could it help — or hurt? Canada faces recession risk over next 6 months, most financial leaders say Amid ‘Buy Canadian’ push, small alcohol producers say trade barriers remain Carney looks to convince financial leaders on how budget will work for them Constructive dismissal in the workplace Liberals negotiate with NDP, Greens on federal budget’s future as Conservatives face turmoil B.C. government closing one of three Granville SROs On the TSX, technology was the only sector to close in the red Thursday, falling 1.84 per cent. “We’ve seen a run-up in valuations in that sector and now I think people are going to start taking profits,” said Brianne Gardner, senior wealth manager with Velocity Investment Partners at Raymond James. “The tech sector really was the biggest loser of the day.” A piece of economic data that caught investors’ attention was a fresh report on U.S. GDP, which suggested the overall U.S. economy’s growth may not have been quite as strong in April as expected. Markets are keenly watching for any signs that could indicate the U.S. Federal Reserve might be getting ready to cut interest rates. Story continues below advertisement While Thursday’s report could be interpreted as evidence in that direction, Gardner said investors are more interested in a different U.S. government report — one that the Federal Reserve prefers to use to measure inflation — set to be released Friday. Trending Now Sex assault charge against ‘Trailer Park Boys’ Bubbles actor ‘won’t be tried in the media’: lawyer 18-year-old woman dies during cruise ship voyage, FBI joins investigation While investors want to see the economy cool enough to prompt central banks to cut interest rates, there is a risk of central bankers waiting too long and tipping the economy into recession, Gardner said. “We think historically, the Fed and the Bank of Canada have been notorious for waiting too long to cut rates,” she said. While summer is typically a quieter time for stock markets, Gardner said the unusual lack of volatility on the TSX so far this year makes her wonder if the market could be headed for a bit of summer-time choppiness. In the meantime, she said there are still pockets of opportunity out there for savvy investors. “The S&P is still 1.3 per cent below its peak, while the TSX is 1.88 per cent below its peak. So there’s still some room to run, and we are still more bullish than bearish on the stock market,” Gardner said. The Canadian dollar traded for 73.11 cents US compared with 72.99 cents US on Wednesday. The July crude contract was down US$1.32 at US$77.91 per barrel and the July natural gas contract was down 10 cents at US$2.57 per 1,000 cubic feet. Story continues below advertisement The August gold contract was up US$2.40 at US$2,366.50 an ounce and the July copper contract was down 13 cents at US$4.66 a pound. — With files from The Associated Press"
