url,url_mobile,title,seendate,socialimage,domain,language,sourcecountry,ticker,industry,search_keyword,article_text
https://www.nbcdfw.com/news/local/garland-cracks-top-10-best-cities-for-women-in-the-tech-industry-study-shows/3473185/,https://www.nbcdfw.com/news/local/garland-cracks-top-10-best-cities-for-women-in-the-tech-industry-study-shows/3473185/?amp=1,Garland deemed one of best US cities for women in tech – NBC 5 Dallas - Fort Worth,20240228T061500Z,https://media.nbcdfw.com/2021/03/GettyImages-550215717.jpg?quality=85&strip=all,nbcdfw.com,English,United States,XLK,Technology,tech industry,"North Texas North Texas town among Top 10 best US cities for women in tech industry, study shows Irving, Plano, Arlington, Fort Worth, and Dallas were also in the Top 50 on the list By De'Anthony Taylor • Published February 27, 2024 • Updated on February 29, 2024 at 4:32 am BOOKMARKER The tech industry is known for its high-paying jobs and comfortable working conditions. However, despite this, women in this field still earn less than their male counterparts in most cities nationwide. Even in the highest-earning areas, women still cannot afford a median-priced home based on the 30% budgeting guideline . Watch NBC 5 free wherever you are WATCH HERE To make it easier for women to decide where to work, RealtyHop conducted a study to find the best cities for women in tech. The study analyzed income-generating potential, housing markets, opportunities for women, and overall location to rank the top 100 cities. Ranked at #9 on the list, Garland, a North Texas city in the Dallas-Fort Worth Metroplex, offers an appealing option for women with the goal of homeownership. Create a free account with NBC 5 DFW to save articles and videos. LEARN MORE According to the new report, Garland has the most affordable housing market in the Top 10 List, where women in tech spend only 38.28% of their income on a home. Homes come onto the market with a median list price of $339,000, and women spend $2,214.22 monthly on their mortgage payments and property taxes. This makes Garland an affordable option for women in tech who want to own their own home and enjoy the benefits of living in a thriving city. In addition to its prosperous job market, Garland is also a great place to live. The city has a vibrant downtown area with plenty of restaurants, bars, and shops. Residents can enjoy the Texas weather in many parks and outdoor spaces. Garland is also home to several great schools, making it an ideal place for families. Local The latest news from around North Texas. Veterans Day 2 hours ago Families, veterans visit DFW National Cemetery despite event cancellation amid shutdown macy's thanksgiving day parade 2 hours ago North Texas' L.D. Bell Blue Raider Band to perform in Macy's Thanksgiving Day Parade These Are the Top 10 Cities for Women Looking for Jobs in Tech (RealtyHop) Key Findings The best city for women in the tech industry is Fremont, Calif. The town has a total score of 56.81 due to a high median income, five-year solid growth, and a higher percentage of women in the industry. Women in Fremont have a better chance of earning a good income and enjoying a high quality of life. The three cities where women outearn men in tech are Stockton, Calif., Santa Ana, Calif., and North Las Vegas, Nevada. These cities may be attractive to women looking to break into the tech industry. On the other hand, the worst city for women in tech is Riverside, Calif. The town has a high income gap compared to men, an unaffordable housing market, and a declining number of women working in the field. Women looking to work in tech may want to avoid Riverside due to these issues. The study found that women earn less than men in 97 out of the 100 cities analyzed. This sobering statistic highlights the need for more action to address the gender pay gap in the tech industry. It's worth noting that women hold more jobs in the tech industry in 57% of cities compared to five years ago. While this is a positive trend, there is still a long way to go to achieve gender parity in this industry. The cities that rank highly on RealtyHop's list may be attractive to women looking to work in tech. Still, it's essential to research and understand each location's unique opportunities and challenges. By being informed, women can make informed decisions and choose the best city for their individual life goals. To view the complete list, methodology, and data, kindly visit RealtyHop's website. Get updates on what's happening in North Texas to your inbox. Sign up for our News Headlines newsletter. This article tagged under: North Texas texas Technology Garland"
https://www.jpost.com/opinion/article-789244,https://m.jpost.com/opinion/article-789244,Israel high - tech industry is a beacon of resilience - opinion,20240228T040000Z,"https://images.jpost.com/image/upload/f_auto,fl_lossy/c_fill,g_faces:center,h_407,w_690/581641",jpost.com,English,Israel,XLK,Technology,tech sector,"Israel's high-tech industry is a beacon of resilience - opinion Despite the challenges and uncertainties, Israeli entrepreneurs and innovators have continued to work, create, and collaborate. AN AION Labs company creation workshop takes place last year in Rehovot. ( photo credit : ELAD MALKA )"
https://www.krqe.com/new-mexico-living/new-mexico-tech-council-to-hold-16th-annual-women-in-tech-awards/,https://www.krqe.com/new-mexico-living/new-mexico-tech-council-to-hold-16th-annual-women-in-tech-awards/amp/,New Mexico Tech Council annual awards recognize women in the tech community,20240227T230000Z,https://www.krqe.com/wp-content/uploads/sites/12/2024/02/Women-in-Tech-awards-2024-on-New-Mexico-Living.png,krqe.com,English,United States,XLK,Technology,tech industry,"by: Audrey Claire Davis Posted: Feb 27, 2024 / 03:27 PM MST Updated: Feb 27, 2024 / 02:02 PM MST SHARE The field of technology is often viewed as a male-dominated industry, but as technological innovations are ever-changing, so are the faces behind those innovations. The New Mexico Tech Council is honoring the women making waves in the industry with its annual “ Women in Tech ” awards. The awards will be held on Wednesday, March 13, 2024, from 11 a.m. to 1:30 p.m., at Hotel Albuquerque. The council says, “The NM ‘Women in Tech’ awards recognize the remarkable women in New Mexico who are driving innovation and excellence in their tech-related fields and inspiring and empowering others to pursue careers in the tech industry.” The New Mexico Tech Council creates a space of collaboration, education, and networking for those involved in the state’s tech industry. The council’s upcoming awards ceremony will be the 16th annual event. Mia Petersen, the executive director of the council, says 2024’s awards will honor 12 women in the tech industry. “The New Mexico ‘Women in Tech’ awards is all about creating a space to recognize the impact that women are having in our local tech economy,” says Petersen. Two of this year’s honorees are Catherine Nicolaou, the broadband manager for the City of Albuquerque, and Lauren Trujillo, the senior advanced solutions consultant for Lumen Technologies. “There’s a lot of paths [into the tech industry], right? And we want to showcase that and mentor these women so that way we can start having more seats at the table,” says Trujillo. To find out more about the New Mexico Tech Council, click here . To learn more about the “Women in Tech” awards, click here . Event registration information can be found at this link . Add as preferred source on Google ✕ Read next > Read next > Next ✕ ✕ Read next > Next story in Cancel Read next > Next story in Cancel"
https://www.dealstreetasia.com/stories/india-space-tech-investments-384680,,New dawn for space tech as India lifts foreign investment curbs,20240227T021500Z,"https://media.dealstreetasia.com/uploads/2020/03/7de6ce26fcbdcb92bd9d03593715c3c9-scaled-e1642999521126.jpg?fit=1024,514",dealstreetasia.com,English,India,XLK,Technology,tech sector,Register Now to Unlock Premium Content Join top professionals who trust DealStreetAsia for their market insights. Get 2 free articles and 1 premium article each month Get free access to Southeast Asia Startup Funding Report: H1 2025. Receive curated newsletters straight to your inbox Be the first to hear about upcoming events and summits Register Now Register now - it only takes a minute! Log in if you already a reader.
https://www.theepochtimes.com/epochtv/ntd-evening-news-full-broadcast-feb-26-3-post-5595514,,LIVE NOW : NTD Evening News Full Broadcast ( Feb . 26 ) ,20240226T233000Z,https://img.theepochtimes.com/assets/uploads/2024/02/26/id5595558-2-1080x720.jpg,theepochtimes.com,English,United States,XLK,Technology,tech industry,"NTD Evening News Full Broadcast (Feb. 26) Like Save Comment Donate Live Chat Subscribe NTD Evening News Full Broadcast (Feb. 26) NTD Evening News Feb-26-2024 The Supreme Court heard arguments Monday in two cases involving content moderation on social media platforms. Tech industry groups sued Texas and Florida over their new laws regulating what the platforms can ban. The industry associations argued that the laws violate their First Amendment rights. President Joe Biden and former... Read More We had a problem loading this article. Please enable javascript or use a different browser. If the issue persists, please visit our help center."
https://wccftech.com/author/ramishz/,,Ramish Zafar,20240226T204500Z,https://cdn.wccftech.com/wp-content/uploads/2022/12/cover-home-1.jpg,wccftech.com,English,United States,XLK,Technology,tech industry,Apple’s Former GPU Supplier Imagination Tech Shares AI GPU Advantages Over NVIDIA
https://techcrunch.com/2024/02/25/amba-kak-creates-policy-recommendations-to-address-ai-concerns/,https://techcrunch.com/2024/02/25/amba-kak-creates-policy-recommendations-to-address-ai-concerns/amp/,Amba Kak creates policy recommendations to address AI concerns,20240225T150000Z,https://techcrunch.com/wp-content/uploads/2024/02/women-in-ai-kak.jpg,techcrunch.com,English,United States,XLK,Technology,tech industry,"To give AI-focused women academics and others their well-deserved — and overdue — time in the spotlight, TechCrunch is launching a series of interviews focusing on remarkable women who’ve contributed to the AI revolution. We’ll publish several pieces throughout the year as the AI boom continues, highlighting key work that often goes unrecognized. Read more profiles here . Amba Kak is the executive director of the AI Now Institute, where she helps create policy recommendations to address AI concerns. She was also a senior AI advisor at the Federal Trade Commission and previously worked as a global policy advisor at Mozilla and a legal advisor to India’s telecom regulator on net-neutrality. Briefly, how did you get your start in AI? What attracted you to the field? It’s not a straightforward question because “AI” is a term that’s in vogue to describe practices and systems that have been evolving for a long time now; I’ve been working on technology policy for over a decade and in multiple parts of the world and witnessed when everything was about “big data,” and then everything became about “AI”. But the core issues we were concerned with — how data-driven technologies and economies impact society — remain the same. I was drawn to these questions early on in law school in India where, amid a sea of decades, sometimes century-old precedent, I found it motivating to work in an area where the “pre-policy” questions, the normative questions of what is the world we want? What role should technology play in it? Remain open-ended and contestable. Globally, at the time, the big debate was whether the internet could be regulated at the national level at all (which now seems like a very obvious, yes!), and in India, there were heated debates about whether a biometric ID database of the entire population was creating a dangerous vector of social control. In the face of narratives of inevitability around AI and technology, I think regulation and advocacy can be a powerful tool to shape the trajectories of tech to serve public interests rather than the bottom lines of companies or just the interests of those who hold power in society. Of course, over the years, I’ve also learned that regulation is often entirely co-opted by these interests too, and can often function to maintain the status quo rather than challenge it. So that’s the work! What work are you most proud of in the AI field? Our 2023 AI Landscape report was released in April in the midst of a crescendo of ChatGPT-fueled AI buzz — was part diagnosis of what should keep us up at night about the AI economy, part action-oriented manifesto aimed at the broader civil society community. It met the moment — a moment when both the diagnosis and what to do about it were sorely missing, and in its place were narratives about AI’s omniscience and inevitability. We underscored that the AI boom was further entrenching the concentration of power within a very narrow section of the tech industry, and I think we successfully pierced through the hype to reorient attention to AI’s impacts on society and on the economy… and not assume any of this was inevitable. Techcrunch event Join the Disrupt 2026 Waitlist Add yourself to the Disrupt 2026 waitlist to be first in line when Early Bird tickets drop. Past Disrupts have brought Google Cloud, Netflix, Microsoft, Box, Phia, a16z, ElevenLabs, Wayve, Hugging Face, Elad Gil, and Vinod Khosla to the stages — part of 250+ industry leaders driving 200+ sessions built to fuel your growth and sharpen your edge. Plus, meet the hundreds of startups innovating across every sector. Join the Disrupt 2026 Waitlist Add yourself to the Disrupt 2026 waitlist to be first in line when Early Bird tickets drop. Past Disrupts have brought Google Cloud, Netflix, Microsoft, Box, Phia, a16z, ElevenLabs, Wayve, Hugging Face, Elad Gil, and Vinod Khosla to the stages — part of 250+ industry leaders driving 200+ sessions built to fuel your growth and sharpen your edge. Plus, meet the hundreds of startups innovating across every sector. San Francisco | October 13-15, 2026 W AITLIST NOW Later in the year, we were able to bring this argument to a room full of government leaders and top AI executives at the UK AI Safety Summit, where I was one of only three civil society voices representing the public interest. It’s been a lesson in realizing the power of a compelling counter-narrative that refocuses attention when it’s easy to get swept up in curated and often self-serving narratives from the tech industry. I’m also really proud of a lot of the work I did during my term as Senior Advisor to the Federal Trade Commission on AI, working on emerging technology issues and some of the key enforcement actions in that domain. It was an incredible team to be a part of, and I also learned the crucial lesson that even one person in the right room at the right time really can make a difference in influencing policymaking. How do you navigate the challenges of the male-dominated tech industry and, by extension, the male-dominated AI industry? The tech industry, and AI in particular, remains overwhelmingly white and male and geographically concentrated in very wealthy urban bubbles. But I like to reframe away from AI’s white dude problem not just because it’s now well known but also because it can sometimes create the illusion of quick fixes or diversity theater that on their own won’t solve the structural inequalities and power imbalances embedded in how the tech industry currently operates. It doesn’t solve the deep-rooted “solutionism” that’s responsible for many harmful or exploitative uses of tech. The real issue we need to contend with is the creation of a small group of companies and, within those — a handful of individuals that have accumulated unprecedented access to capital, networks, and power, reaping the rewards of the surveillance business model that powered the last decade of the internet. And this concentration of power is tipped to get much, much worse with AI. These individuals act with impunity, even as the platforms and infrastructures they control have enormous social and economic impacts. How do we navigate this? By exposing the power dynamics that the tech industry tries very hard to conceal. We talk about the incentives, infrastructures, labor markets, and the environment that power these waves of technology and shape the direction it will take. This is what we’ve been doing at AI Now for close to a decade, and when we do this well, we find it is difficult for policymakers and the public to look away — creating counter-narratives and alternative imaginations for the appropriate role of technology within society. What advice would you give to women seeking to enter the AI field? For women, but also for other minoritized identities or perspectives seeking to make critiques from outside the AI industry, the best advice I could give is to stand your ground. This is a field that routinely and systematically will attempt to discredit critique, especially when it comes from not traditionally STEM backgrounds – and it’s easy to do given that AI is such an opaque industry that can make you feel like you’re always trying to push back from the outside. Even when you’ve been in the field for decades like I have, powerful voices in the industry will try and undermine you and your valid critique simply because you are challenging the status quo. You and I have as much of a say in the future of AI as Sam Altman does since the technologies will impact us all and potentially will disproportionately impact people of minoritized identities in harmful ways. Right now, we’re in a fight for who gets to claim expertise and authority on matters of technology within society… so we really need to claim that space and hold our ground."
https://www.cnbc.com/2024/02/24/why-widespread-tech-layoffs-keep-happening-despite-strong-us-economy.html,https://www.cnbc.com/amp/2024/02/24/why-widespread-tech-layoffs-keep-happening-despite-strong-us-economy.html,Why widespread tech layoffs keep happening despite strong U . S . economy,20240224T153000Z,https://image.cnbcfm.com/api/v1/image/107147487-1667854565525-GettyImages-1205578716.jpg?v=1708718414,cnbc.com,English,United States,XLK,Technology,tech industry,"Skip Navigation Markets Business Investing Tech Politics Video Watchlist Investing Club PRO Livestream Menu The tech sector is having a big 2024. Nvidia just crushed earnings expectations . The artificial intelligence boom remains in full swing. The tech-heavy Nasdaq index is up more than 8 percent year to date. The U.S. economy is also doing surprisingly well, adding 353,000 jobs in January, well ahead of economists' forecasts. Hotter-than-expected inflation data may also keep the Fed from cutting rates as soon as the market expects, a sign that the economy remains strong enough to support tighter monetary policy for longer. It's a different story for tech workers, though. ""The layoffs to the start of 2024 signal a dramatic shift in the tech industry,"" said Jeff Shulman, professor at the University of Washington's Foster School of Business. ""We're going to continue to see layoffs happen as the future of work has changed, as the future of technology has changed and as investors' appetite for risk and growth versus profitability has dramatically changed as well."" The number of tech sector layoffs in 2024 has been outpacing the number of terminations in 2023. So far, about 42,324 tech employees were let go in 2024, according to Layoffs.fyi , which tracks layoffs in the tech industry. That averages out to more than 780 layoffs each day in 2024. In 2023, nearly 263,000 tech employees got laid off, averaging to about 720 layoffs each day that year. There are several factors behind the churn. AI is at the forefront. Companies need to free up cash to invest in the chips and servers that power the AI models behind these new technologies. There's also the stock market effect. Companies that conducted layoffs haven't been punished, either by investors or on their bottom lines. In fact, they've been rewarded with rising stock prices. Watch the video above to learn why another rough year of layoffs may lie ahead for tech workers, and why the surprising strength of the U.S. economy may not be coming to their rescue."
https://www.nbcphiladelphia.com/news/business/money-report/why-widespread-tech-layoffs-keep-happening-despite-a-strong-u-s-economy/3784974/,https://www.nbcphiladelphia.com/news/business/money-report/why-widespread-tech-layoffs-keep-happening-despite-a-strong-u-s-economy/3784974/?amp=1,Why widespread tech layoffs keep happening despite a strong U . S . economy,20240224T144500Z,https://media.nbcphiladelphia.com/2024/02/107147487-1667854565525-GettyImages-1205578716.jpg?quality=85&strip=all,nbcphiladelphia.com,English,United States,XLK,Technology,tech sector,"Money Report In partnership with News Why widespread tech layoffs keep happening despite a strong U.S. economy By Jeff Morganteen,CNBC and Anuz Thapa,CNBC • Published February 24, 2024 • Updated on February 24, 2024 at 9:07 am BOOKMARKER ljubaphoto | E+ | Getty Images The tech sector is having a big 2024. Nvidia just crushed earnings expectations . The artificial intelligence boom remains in full swing. The tech-heavy Nasdaq index is up more than 8 percent year to date. The U.S. economy is also doing surprisingly well, adding 353,000 jobs in January, well ahead of economists' forecasts. Hotter-than-expected inflation data may also keep the Fed from cutting rates as soon as the market expects, a sign that the economy remains strong enough to support tighter monetary policy for longer. It's a different story for tech workers, though. ""The layoffs to the start of 2024 signal a dramatic shift in the tech industry,"" said Jeff Shulman, professor at the University of Washington's Foster School of Business. ""We're going to continue to see layoffs happen as the future of work has changed, as the future of technology has changed and as investors' appetite for risk and growth versus profitability has dramatically changed as well."" Stream Philadelphia News for free, 24/7, wherever you are with NBC10. WATCH HERE The number of tech sector layoffs in 2024 has been outpacing the number of terminations in 2023. So far, about 42,324 tech employees were let go in 2024, according to Layoffs.fyi , which tracks layoffs in the tech industry. That averages out to more than 780 layoffs each day in 2024. In 2023, nearly 263,000 tech employees got laid off, averaging to about 720 layoffs each day that year. There are several factors behind the churn. AI is at the forefront. Companies need to free up cash to invest in the chips and servers that power the AI models behind these new technologies. There's also the stock market effect. Companies that conducted layoffs haven't been punished, either by investors or on their bottom lines. In fact, they've been rewarded with rising stock prices. Watch the video above to learn why another rough year of layoffs may lie ahead for tech workers, and why the surprising strength of the U.S. economy may not be coming to their rescue. Also on CNBC Nvidia briefly surpasses $2 trillion in market cap during intraday trading AI can help defend against cybersecurity threats: Google CEO Sundar Pichai Ride-hailing giant Grab turns profitable for the first time Subscribe to the CNBC YouTube Channel Morning Squawk Newsletter Copyright CNBC This article tagged under: News"
