url,url_mobile,title,seendate,socialimage,domain,language,sourcecountry,ticker,industry,search_keyword,article_text
https://finance.yahoo.com/news/top-stocks-consider-cooler-pce-230000053.html,,Top Stocks to Consider After Cooler PCE Data,20240629T011500Z,https://media.zenfs.com/en/zacks.com/cbe09dd8ba292b253ca69daed1bc9d08,finance.yahoo.com,English,United States,XLK,Technology,tech sector,"Top Stocks to Consider After Cooler PCE Data Shaun Pruitt June 28, 2024 3 min read SDAWW Notably, the Personal Consumption Expenditures (PCE) Price Index tracks changes in the cost of goods and services purchased by consumers in the United States through the lens of businesses. Additionally, Core PCE is a key economic indicator the Federal Reserve uses to gauge inflation by measuring the average change in these consumer goods prices when excluding volatile items like food and energy. With Core PCE being the Fed's preferred inflationary measure, this reading optimistically cooled to a 0.1% uptick in May compared to a 0.3% increase in April. Year over year, Core PCE rose by 2.6% which Yahoo Finance points out was the slowest annual gain in three years. Although this is still above the Fed’s preferred target of a 2% annual inflation rate, May’s Core PCE data is a positive sign for the economy and stocks. Considering last month’s Consumer Price Index (CPI) data showed a cooler print as well, here are three stocks investors may want to consider on the prospects of a more favorable operating environment. Yahoo Finance Image Source: Yahoo Finance Nvidia NVDA Easing inflation is crucial to the tech sector regarding internal operating costs and the willingness of not only consumers but also businesses to spend on technology which in many instances can be deemed non-essential despite its clear importance. Perhaps broader spending on artificial intelligence continues to increase and keeps Nvidia’s stock attractive as the leader in producing AI chips. Tracking Nvidia’s performance since its 10-1 stock split on June 10, NVDA is only up +2% but had already more than doubled this year beforehand with a very positive trend of earnings estimate revisions suggesting more upside. Correlating with such, the chip giant sports a Zacks Rank #1 (Strong Buy) amid what continues to be captivating growth on its top and bottom lines. Zacks Investment Research Image Source: Zacks Investment Research Amazon AMZN Outside of the tech sector, the obvious beneficiaries of a more stable inflationary environment are consumer retail-driven companies and no one stands out more in this regard than e-commerce giant Amazon. The market is suggesting this as well as Amazon’s stock spiked +10% this month and currently lands a Zacks Rank #3 (Hold) with gains already at +27% for the year. Zacks Investment Research Image Source: Zacks Investment Research Bank of America BAC Although banks can benefit from a high inflationary environment higher loan volumes and net inflows from depsits look plausible in both commercial and consumer segments if reseeding PCE and better-than-expected CPI data were to continue. Story Continues Furthermore, one bank that excels in its use of technology and can benefit from the perceived notion of lower technology costs is Bank of America which sports a Zacks Rank #2 (Buy). Bank of America’s attractive price tag may also interest investors as its stock costs less than many of the other big banks at just under $40 while its forward P/E of 12.1X is on par with most of its peers. While Bank of America has traded at sharper P/E discounts in the past it's noteworthy that earnings estimates for FY24 and FY25 are slightly up over the last 60 days. Zacks Investment Research Image Source: Zacks Investment Research BAC also has a 2.45% annual dividend yield that only trails Citigroup’s C 3.44% out of the big four domestic banks as this edges Wells Fargo’s WFC 2.44% and JPMorgan’s JPM 2.31%. Zacks Investment Research Image Source: Zacks Investment Research Final Thought Rounding out Q2, reseeding core PCE is a good sign for businesses and the broader economy with Nvidia, Amazon, and Bank of America being three stocks to keep an eye on next quarter. Want the latest recommendations from Zacks Investment Research? Today, you can download 7 Best Stocks for the Next 30 Days. Click to get this free report Amazon.com, Inc. (AMZN) : Free Stock Analysis Report Bank of America Corporation (BAC) : Free Stock Analysis Report NVIDIA Corporation (NVDA) : Free Stock Analysis Report Wells Fargo & Company (WFC) : Free Stock Analysis Report JPMorgan Chase & Co. (JPM) : Free Stock Analysis Report Citigroup Inc. (C) : Free Stock Analysis Report To read this article on Zacks.com click here. Zacks Investment Research View Comments Terms and Privacy Policy Privacy Dashboard More Info"
https://www.moneycontrol.com/mc-buzz/the-power-of-integration-exploring-g7crs-impact-on-industry-wide-customer-experience-standards-article-12758508.html,https://www.moneycontrol.com/mc-buzz/the-power-of-integration-exploring-g7crs-impact-on-industry-wide-customer-experience-standards-article-12758508.html/amp,The Power of Integration : Exploring G7CR Impact on Industry - Wide Customer Experience Standards,20240628T154500Z,https://images.moneycontrol.com/static-mcnews/2024/06/20240628150308_mcimage.jpg,moneycontrol.com,English,India,XLK,Technology,tech industry,"Home MC Buzz The Power of Integration: Exploring G7 CR's Impact on Industry-Wide Customer Experience Standards The Power of Integration: Exploring G7 CR's Impact on Industry-Wide Customer Experience Standards Happy customers are the biggest advocates – so make their experience a delight, not a disaster. By integrating expertise, fostering seamless communication, and prioritizing customer needs, we're redefining what exceptional CX means in the tech industry. BRAND CONNECT June 29, 2024 / 11:25 IST G7 CR Technologies – a Noventiq company Unveils G7 CR 2.0 The tech industry is a powerhouse of innovation, constantly pushing the boundaries of what's possible. Yet, when it comes to customer experience (CX), many tech companies are stuck in the past. Complex organizational structures, multiple departments, each with limited knowledge of complex tech ecosystems, create a disjointed and agonizing experience for customers. Endless call transfers, repetitive explanations, and robotic interactions are the norm, not the exception. G7 CR Technologies – a Noventiq company emerges as a leader, putting an end to such grave practices, spearheading a paradigm shift in tech industry-wide customer experience standards through our Unified Customer Experience (UCX) Strategy . Exceptional CX goes beyond resolving issues. It's about fostering a sense of connection with your customers and fixing the traditional CX gaps such as: 1. Lack of Tech Expertise and Environment Understanding: Tech support personnel often lack either the technical knowledge or the understanding of the client's specific environment, leading to prolonged problem-solving times. 2. Fragmented Support Teams: Different teams handle various aspects of support—data, network, billing—leading to a fragmented and frustrating customer experience. 3. Inefficient Inter- Department Collaboration: Tech support often requires input from billing or finance departments, causing delays due to the lack of synchronization between these departments. 4. Repetitive Explanations: Customers repeatedly need to explain their environment and issues to different support personnel, wasting valuable time and increasing frustration. Beyond Transactions; Building Relationships: The G7 CR Way! Investing in exceptional CX isn't just an expense, it's a strategic investment. By prioritizing speed, convenience, knowledgeable support, and a user-centric approach, we can create a loyal customer base that fuels sustainable growth. Remember, happy customers are the biggest advocates – so make their experience a delight, not a disaster. By integrating expertise, fostering seamless communication, and prioritizing customer needs, we're redefining what exceptional CX means in the tech industry. At G7 CR, we give every customer the luxury of having a dedicated team of experts from every related department– billing, technical support, account management and so on – all dedicated to solving the problems efficiently and in a hassle-free way! Transformative Impacts of G7 CR’s Unified CX for Businesses and Customers By unifying disparateverticals of the tech ecosystem, G7 CR ensures that customers enjoy a seamless and consistent experience across all interactions. With G7 CR's UCX strategy, customers can expect a cohesive journey that anticipates their needs and exceeds their expectations at every turn. But the impact of G7 CR's integration strategy extends far beyond just enhancing customer satisfaction. For organizations, it represents a transformative opportunity to drive growth and maximize ROI. Here's how G7 CR's approach is a game-changer, and impacts the tech Industry by raising the bars of customer experience: Enhanced Operational Efficiency: G7 CR's Unified Customer Experience strategy enables tech businesses to streamline their processes, eliminating inefficiencies and reducing operational costs. By integrating data and systems across departments, businesses can optimize workflows, automate repetitive tasks, and free up valuable resources to focus on strategic initiatives. Accelerated Time-to-Market: Today in the tech market, speed is of the essence. G7 CR's Unified Customer Experience strategy empowers tech businesses to bring products and services to market faster by streamlining development cycles and accelerating time-to-market. By breaking down disparities and fostering collaboration, businesses can iterate more quickly, respond to market demands faster, and gain a competitive edge. Improved Customer Retention: Customer retention is crucial for long-term success. With G7 CR's Unified Customer Experience strategy, tech businesses can enhance customer satisfaction and loyalty by delivering consistent, personalized experiences across every touchpoint. By understanding customer needs and preferences, businesses can anticipate their needs, proactively address issues, and build stronger relationships that withstand the test of time. Enhanced Brand Reputation: A positive customer experience can do wonders for brand reputation. By adopting G7 CR's Unified Customer Experience strategy, tech businesses can differentiate themselves from competitors and earn a reputation for excellence in customer service. By consistently exceeding customer expectations, businesses can build trust, credibility, and goodwill, strengthening their brand and driving customer advocacy. Data-Driven Insights: G7 CR's Unified Customer Experience strategy provides tech businesses with valuable insights derived from integrated data sources. By analyzing customer data, businesses can gain a deeper understanding of their audience, identify trends and patterns, and make data-driven decisions that drive growth and innovation. From identifying emerging market opportunities to predicting customer behavior, data insights can inform strategic initiatives and drive business success. Personalized Experience: G7 CR's Unified Customer Experience strategy revolutionizes the way customers interact with tech businesses by providing personalized experiences tailored to their unique needs and preferences. Through advanced data analytics and integrated systems, customers receive customized recommendations, content, and support, enhancing their overall satisfaction and engagement. Seamless Interactions: With G7 CR's Unified Customer Experience strategy, customers enjoy seamless interactions across multiple channels, including phone, email, and chat. By consolidating customer data and streamlining communication channels, tech businesses can provide consistent, frictionless experiences that delight customers at every touchpoint. Proactive Support: No more waiting for issues to escalate before getting help. G7 CR's Unified Customer Experience strategy enables businesses to anticipate customer needs and provide proactive support before problems arise. Through predictive analytics and AI-driven insights, tech businesses can identify potential issues, offer timely solutions,prevent disruptions, enhancing customer satisfaction and loyalty. Increased Trust and Loyalty: By delivering consistent, personalized experiences that exceed customer expectations, G7 CR's Unified Customer Experience strategy builds trust and fosters loyalty among customers. By demonstrating a deep understanding of their needs and preferences, businesses can earn the trust and loyalty of their customers, driving repeat business, positive word-of-mouth referrals, and long-term success. G7 CR Technologies stands at the forefront of this fundamental change in the tech industry's approach to customer experience. Through our Unified CX Strategy, we've overcome the gaps that once hindered exceptional customer experience, organizational growth, and customer retention. By integrating expertise and communication, we've redefined what it means to deliver exceptional CX. It's not merely about customer satisfaction; it's about paving the way for unprecedented growth and advocacy for businesses. As pioneers in this integrated future, G7 CR is not just leading – we're setting the standard for customer experience, empowering each customer to experience the best of tech industry. Moneycontrol Journalists are not involved in creation of this article. BRAND CONNECT *Disclaimer - Brand Connect is a solution that allows brands to break the queue to gain better engagement among our audiences first published: Jun 28, 2024 08:36 pm Discover the latest Business News , Sensex , and Nifty updates. Obtain Personal Finance insights, tax queries, and expert opinions on Moneycontrol or download the Moneycontrol App to stay updated! Advisory Alert: It has come to our attention that certain individuals are representing themselves as affiliates of Moneycontrol and soliciting funds on the false promise of assured returns on their investments. We wish to reiterate that Moneycontrol does not solicit funds from investors and neither does it promise any assured returns. In case you are approached by anyone making such claims, please write to us at grievanceofficer@nw18.com or call on 02268882347 You got 30 Day’s Trial of Grab it Now Ad-Free Experience Top Articles from Financial Times Actionable Insights MC Research Economic Calendar & Many More You are already a Moneycontrol Pro user. OK Riya Gandhi"
https://freerepublic.com/focus/f-chat/4247264/posts,,Bill Gates and Warren Buffett Team Up to Transform Nuclear Power,20240628T050000Z,,freerepublic.com,English,United States,XLK,Technology,tech sector,"Free Republic Browse · Search General/Chat Topics · Post Article Skip to comments. Bill Gates and Warren Buffett Team Up to Transform Nuclear Power Oil Price ^ | 06/27/2024 | Haley Zaremba Posted on 06/27/2024 9:14:55 PM PDT by SeekAndFind Bill Gates is pledging billions to promote next-generation nuclear power through TerraPower, focusing on innovations that could make nuclear a key player in global decarbonization. Increasing energy demands from the AI sector prompt tech leaders like Sam Altman and Bill Gates to advocate for nuclear power as a sustainable solution. Innovations in nuclear technology, including smaller, more standardized reactors, aim to reduce construction costs and compete with natural gas. Bill Gates is ready to sink billions into getting next-generation nuclear energy off the ground in the United States. The world’s sixth richest man has been a staunch nuclear supporter for years now, and has already sunk over a billion dollars of his own money into his innovative nuclear power start-up TerraPower LLC. But according to Gates, that cool billion is just the beginning. “I put in over a billion, and I’ll put in billions more,” Gates was recently quoted by Bloomberg. Nuclear power has been gaining traction around the globe as a viable option for national and private decarbonization strategies. Nuclear advocates argue that we can no longer afford to ignore nuclear’s immense clean energy potential, as it is a proven technology with plenty of existing infrastructure, legal precedent and huge output capacity. While it is not considered to be a renewable energy, nuclear energy emits zero carbon emissions and could be a key part of a viable pathway to meeting global emissions targets. Finding new ways to drum up a whole lot of clean energy output in a hurry has become increasingly urgent as the tech sector, and Artificial Intelligence in particular , suck up rapidly increasingly colossal amounts of energy. (Excerpt) Read more at oilprice.com ... TOPICS: Business/Economy ; Science ; Society KEYWORDS: billgates ; energy ; nuclearpower ; warrenbuffett Navigation: use the links below to view more comments. first 1-20 , 21-26 next last In fact, the increased demand from the tech sector has become so extreme that, for the first time in years, energy demand growth from the developed world has surpassed that of developing countries, flipping a long-running script on its head. 1 posted on 06/27/2024 9:14:55 PM PDT by SeekAndFind [ Post Reply | Private Reply | View Replies ] To: SeekAndFind That would be good. Small Modular Reactors (SMR) can become the primary source of generation in a decade if we had a “man on the moon” type national priority program. 2 posted on 06/27/2024 9:19:18 PM PDT by bigbob [ Post Reply | Private Reply | To 1 | View Replies ] To: SeekAndFind Finally, I can agree with Bill Gates! 3 posted on 06/27/2024 9:24:00 PM PDT by AZJeep [ Post Reply | Private Reply | To 1 | View Replies ] To: SeekAndFind I haven’t heard much about Warren Buffet for years. Is he still a Democrat? 4 posted on 06/27/2024 9:33:12 PM PDT by Dat [ Post Reply | Private Reply | To 1 | View Replies ] To: AZJeep Yeah no kidding, what’s the catch? If France can do it why can’t we? 5 posted on 06/27/2024 9:33:17 PM PDT by broken_clock (Go Trump! Still praying.) [ Post Reply | Private Reply | To 3 | View Replies ] To: AZJeep Finally, I can agree with Bill Gates! ><>< Me, too on this, but Gates and his cronies always have ulterior motives which are not good. 6 posted on 06/27/2024 9:43:29 PM PDT by laplata (They want each crisis to take the greatest toll possible.) [ Post Reply | Private Reply | To 3 | View Replies ] To: AZJeep This would be something I would invest in. 7 posted on 06/27/2024 10:18:10 PM PDT by The Duke (Not without incident.) [ Post Reply | Private Reply | To 3 | View Replies ] To: SeekAndFind Thorium reactors maybe or is that too 1960’s? 8 posted on 06/28/2024 12:16:47 AM PDT by LastDayz (A blunt and brazen Texan. I will not be assimilated.) [ Post Reply | Private Reply | To 1 | View Replies ] To: SeekAndFind I thought Gates was a tree hugger. 9 posted on 06/28/2024 12:31:06 AM PDT by HIDEK6 (God bless Donald Trump) [ Post Reply | Private Reply | To 1 | View Replies ] To: SeekAndFind Someone who knows nothing about technology teamed up with someone who bought an operating system and put his name on it. What could go wrong? “Hey we can probably reuse the Blue Screen of Death!” 10 posted on 06/28/2024 2:21:27 AM PDT by Zathras [ Post Reply | Private Reply | To 1 | View Replies ] To: SeekAndFind I’m guessing at some point Martin Sheen will be rolled out long enough to say nuclear power bad. 11 posted on 06/28/2024 3:33:15 AM PDT by EQAndyBuzz (Trump/Burgum 2024.) [ Post Reply | Private Reply | To 1 | View Replies ] To: SeekAndFind Great plan, except that they are at least three decades late. This simply goes to prove the point that some billionaires get rich because they were smart businessmen, and some get rich because they were lucky. Gates and Buffett are clearly the latter. 12 posted on 06/28/2024 3:33:42 AM PDT by norwaypinesavage (Freud: projection is a defense mechanism of those struggling with inferiority complexes) [ Post Reply | Private Reply | To 1 | View Replies ] To: SeekAndFind Any individual who discontinues Bill Gates will be a hero to civilization. How much death can one person cause? 13 posted on 06/28/2024 3:35:06 AM PDT by PGalt (Past Peak Civilization?) [ Post Reply | Private Reply | To 1 | View Replies ] To: bigbob A general discussion on small reactors has been going on now for twenty years at least. Small thorium reactors was once the touchstone, now I’m not sure what invention leads the way. 14 posted on 06/28/2024 3:53:44 AM PDT by Bookshelf [ Post Reply | Private Reply | To 2 | View Replies ] To: laplata Me, too on this, but Gates and his cronies always have ulterior motives which are not good. — If he did before, then he does now. Spots do not change. 15 posted on 06/28/2024 4:17:02 AM PDT by PIF (They came for me and mine ... now its your turn) [ Post Reply | Private Reply | To 6 | View Replies ] To: PGalt Standard policy: keep omnicidal depopulationists away from nukes. 16 posted on 06/28/2024 4:42:24 AM PDT by conservativeimage (Divorce the Deep State and Reconstruct Civilian Government: https://tasa.americanstatenationals.org) [ Post Reply | Private Reply | To 13 | View Replies ] To: The Duke “This would be something I would invest in.” Go ahead (SMR). I did. Also Fuel Cell Energy (FECL). They go together. Efficient co-generation and hydrogen too. 17 posted on 06/28/2024 5:35:22 AM PDT by JeanLM [ Post Reply | Private Reply | To 7 | View Replies ] To: JeanLM Thank you! :) 18 posted on 06/28/2024 5:37:47 AM PDT by The Duke (Not without incident.) [ Post Reply | Private Reply | To 17 | View Replies ] To: bigbob “That would be good. Small Modular Reactors (SMR) can become the primary source of generation in a decade if we had a “man on the moon” type national priority program.” It needs to be faster than that. It needs to be more like a Manhattan project combined with manufacturing on the scale of WWII for the military. 19 posted on 06/28/2024 5:39:30 AM PDT by Wuli [ Post Reply | Private Reply | To 2 | View Replies ] To: LastDayz The Terrapower Natrium is fast neutron spectrum sodium cooled reactor. It breeds and burns plutonium and should yield high fuel burnup. I haven't completed reading the Preliminary Safety Analysis Report (PSAR) at https://www.nrc.gov/docs/ML2408/ML24088A065.pdf . It is a very interesting design. Mass production of these plants could yield interesting economics. I haven't read the referenced article yet, but they broke ground June 10th in Wyoming for the “secondary” plant and awaiting NRC approval. 20 posted on 06/28/2024 5:54:45 AM PDT by 103198 (It's the metadata stupid...) [ Post Reply | Private Reply | To 8 | View Replies ] Navigation: use the links below to view more comments. first 1-20 , 21-26 next last Disclaimer: Opinions posted on Free Republic are those of the individual posters and do not necessarily represent the opinion of Free Republic or its management. All materials posted herein are protected by copyright law and the exemption for fair use of copyrighted works. Free Republic Browse · Search General/Chat Topics · Post Article FreeRepublic , LLC, PO BOX 9771, FRESNO, CA 93794 FreeRepublic.com is powered by software copyright 2000-2008 John Robinson"
